"No.","Time","Source","Destination","Protocol","Length","Info"
"1","0.000000","192.168.137.22","44.227.237.70","TLSv1.1","119","Application Data"
"2","0.093402","44.227.237.70","192.168.137.22","TCP","66","5223  >  55513 [ACK] Seq=1 Ack=54 Win=412 Len=0 TSval=3472170895 TSecr=22723"
"3","1.140900","Dell_c7:e0:05","Broadcast","ARP","42","Who has 10.0.0.1? Tell 192.168.137.1"
"4","1.919439","Dell_c7:e0:05","Broadcast","ARP","42","Who has 10.0.0.1? Tell 192.168.137.1"
"5","2.908324","Dell_c7:e0:05","Broadcast","ARP","42","Who has 10.0.0.1? Tell 192.168.137.1"
"6","2.972691","192.168.137.22","44.227.237.70","TLSv1.1","311","Application Data"
"7","3.033738","192.168.137.22","23.196.34.146","TLSv1.1","119","Encrypted Alert"
"8","3.034540","192.168.137.22","23.196.34.146","TCP","66","55145  >  443 [FIN, ACK] Seq=54 Ack=1 Win=65535 Len=0 TSval=2172 TSecr=1260582717"
"9","3.034939","192.168.137.22","192.168.137.1","DNS","96","Standard query 0xd4d9 A us-prof.np.community.playstation.net"
"10","3.054269","192.168.137.1","192.168.137.22","DNS","301","Standard query response 0xd4d9 A us-prof.np.community.playstation.net CNAME 13673-wildcard.np.community.playstation.net.edgekey.net CNAME 13673-wildcard.np.community.playstation.net.edgekey.net.globalredir.akadns.net CNAME e13673.b.akamaiedge.net A 23.193.42.11"
"11","3.056363","23.196.34.146","192.168.137.22","TCP","54","443  >  55145 [RST] Seq=1 Win=0 Len=0"
"12","3.066532","44.227.237.70","192.168.137.22","TCP","66","5223  >  55513 [ACK] Seq=1 Ack=299 Win=416 Len=0 TSval=3472173868 TSecr=22729"
"13","3.069082","192.168.137.22","23.193.42.11","TCP","78","55131  >  443 [SYN] Seq=0 Win=65535 Len=0 MSS=1460 WS=1 SACK_PERM=1 TSval=0 TSecr=0"
"14","3.097756","23.193.42.11","192.168.137.22","TCP","74","443  >  55131 [SYN, ACK] Seq=0 Ack=1 Win=28960 Len=0 MSS=1460 SACK_PERM=1 TSval=542666637 TSecr=0 WS=128"
"15","3.100059","192.168.137.22","23.193.42.11","TCP","66","55131  >  443 [ACK] Seq=1 Ack=1 Win=65535 Len=0 TSval=0 TSecr=542666637"
"16","3.102964","192.168.137.22","23.193.42.11","TLSv1.1","126","Client Hello"
"17","3.130471","23.193.42.11","192.168.137.22","TCP","66","443  >  55131 [ACK] Seq=1 Ack=61 Win=29056 Len=0 TSval=542666668 TSecr=0"
"18","3.130500","23.193.42.11","192.168.137.22","TLSv1.1","1514","Server Hello"
"19","3.130516","23.193.42.11","192.168.137.22","TCP","1514","443  >  55131 [ACK] Seq=1449 Ack=61 Win=29056 Len=1448 TSval=542666669 TSecr=0 [TCP segment of a reassembled PDU]"
"20","3.130530","23.193.42.11","192.168.137.22","TLSv1.1","245","Certificate, Server Hello Done"
"21","3.132828","192.168.137.22","23.193.42.11","TCP","66","55131  >  443 [ACK] Seq=61 Ack=2897 Win=62804 Len=0 TSval=0 TSecr=542666669"
"22","3.133230","192.168.137.22","23.193.42.11","TCP","66","55131  >  443 [ACK] Seq=61 Ack=3076 Win=65535 Len=0 TSval=0 TSecr=542666669"
"23","3.227502","192.168.137.22","23.193.42.11","TLSv1.1","408","Client Key Exchange, Change Cipher Spec, Encrypted Handshake Message"
"24","3.262957","23.193.42.11","192.168.137.22","TLSv1.1","141","Change Cipher Spec, Encrypted Handshake Message"
"25","3.268381","192.168.137.22","23.193.42.11","TLSv1.1","1095","Application Data"
"26","3.268381","192.168.137.22","23.193.42.11","TLSv1.1","183","Application Data"
"27","3.298267","23.193.42.11","192.168.137.22","TCP","66","443  >  55131 [ACK] Seq=3151 Ack=1549 Win=32128 Len=0 TSval=542666836 TSecr=0"
"28","3.437821","23.193.42.11","192.168.137.22","TLSv1.1","503","Application Data"
"29","3.450493","35.161.195.31","192.168.137.22","TLSv1.1","375","Application Data"
"30","3.637482","192.168.137.22","23.193.42.11","TCP","66","55131  >  443 [ACK] Seq=1549 Ack=3588 Win=65535 Len=0 TSval=1 TSecr=542666976"
"31","3.647752","192.168.137.22","35.161.195.31","TCP","66","55485  >  443 [ACK] Seq=1 Ack=310 Win=65535 Len=0 TSval=22716 TSecr=3187143711"
"32","9.758237","192.168.137.22","192.168.137.1","DNS","104","Standard query 0x8996 A static-resource.np.community.playstation.net"
"33","9.778880","192.168.137.1","192.168.137.22","DNS","220","Standard query response 0x8996 A static-resource.np.community.playstation.net CNAME static-resource.np.community.playstation.net.edgekey.net CNAME e6234.g.akamaiedge.net A 23.195.100.205"
"34","9.781088","192.168.137.22","23.195.100.205","TCP","78","55130  >  80 [SYN] Seq=0 Win=65535 Len=0 MSS=1460 WS=1 SACK_PERM=1 TSval=0 TSecr=0"
"35","9.807452","23.195.100.205","192.168.137.22","TCP","74","80  >  55130 [SYN, ACK] Seq=0 Ack=1 Win=28960 Len=0 MSS=1460 SACK_PERM=1 TSval=3678935545 TSecr=0 WS=128"
"36","9.810067","192.168.137.22","23.195.100.205","TCP","66","55130  >  80 [ACK] Seq=1 Ack=1 Win=65535 Len=0 TSval=0 TSecr=3678935545"
"37","9.810067","192.168.137.22","23.195.100.205","HTTP","232","GET /np/resource/trophy/trophy-status.xml HTTP/1.1 "
"38","9.844252","23.195.100.205","192.168.137.22","TCP","66","80  >  55130 [ACK] Seq=1 Ack=167 Win=30080 Len=0 TSval=3678935581 TSecr=0"
"39","9.845943","23.195.100.205","192.168.137.22","HTTP/XML","584","HTTP/1.1 200 OK "
"40","9.848562","192.168.137.22","23.195.100.205","TCP","66","55130  >  80 [FIN, ACK] Seq=167 Ack=519 Win=65535 Len=0 TSval=1 TSecr=3678935584"
"41","9.878737","23.195.100.205","192.168.137.22","TCP","66","80  >  55130 [FIN, ACK] Seq=519 Ack=168 Win=30080 Len=0 TSval=3678935614 TSecr=1"
"42","9.881081","192.168.137.22","23.195.100.205","TCP","66","55130  >  80 [ACK] Seq=168 Ack=520 Win=65535 Len=0 TSval=1 TSecr=3678935614"
"43","11.249886","44.227.237.70","192.168.137.22","TLSv1.1","583","Application Data"
"44","11.447250","192.168.137.22","44.227.237.70","TCP","66","55513  >  5223 [ACK] Seq=299 Ack=518 Win=65535 Len=0 TSval=22746 TSecr=3472182052"
"45","15.449996","192.168.137.1","192.168.137.255","UDP","86","57621  >  57621 Len=44"
"46","16.131214","Dell_c7:e0:05","Broadcast","ARP","42","Who has 10.0.0.1? Tell 192.168.137.1"
"47","16.829900","192.168.137.22","35.161.195.31","TLSv1.1","119","Application Data"
"48","16.910942","Dell_c7:e0:05","Broadcast","ARP","42","Who has 10.0.0.1? Tell 192.168.137.1"
"49","16.923654","35.161.195.31","192.168.137.22","TLSv1.1","119","Application Data"
"50","17.117211","192.168.137.22","35.161.195.31","TCP","66","55485  >  443 [ACK] Seq=54 Ack=363 Win=65535 Len=0 TSval=22743 TSecr=3187157185"
"51","17.913081","Dell_c7:e0:05","Broadcast","ARP","42","Who has 10.0.0.1? Tell 192.168.137.1"
"52","19.704521","192.168.137.1","224.0.0.251","MDNS","87","Standard query 0x0000 PTR _spotify-connect._tcp.local, ""QM"" question"
"53","21.482554","192.168.137.1","239.255.255.250","SSDP","167","M-SEARCH * HTTP/1.1 "
"54","31.141236","Dell_c7:e0:05","Broadcast","ARP","42","Who has 10.0.0.1? Tell 192.168.137.1"
"55","31.916238","Dell_c7:e0:05","Broadcast","ARP","42","Who has 10.0.0.1? Tell 192.168.137.1"
"56","32.915682","Dell_c7:e0:05","Broadcast","ARP","42","Who has 10.0.0.1? Tell 192.168.137.1"
"57","38.958958","192.168.137.22","192.168.137.1","DNS","91","Standard query 0x281e A gs-sec.ww.np.dl.playstation.net"
"58","38.978855","192.168.137.1","192.168.137.22","DNS","192","Standard query response 0x281e A gs-sec.ww.np.dl.playstation.net CNAME wild.ww.np.dl.playstation.net.edgekey.net CNAME e1800.d.akamaiedge.net A 23.64.80.77"
"59","38.982549","192.168.137.22","23.64.80.77","TCP","78","55129  >  443 [SYN] Seq=0 Win=65535 Len=0 MSS=1460 WS=1 SACK_PERM=1 TSval=0 TSecr=0"
"60","39.014164","23.64.80.77","192.168.137.22","TCP","74","443  >  55129 [SYN, ACK] Seq=0 Ack=1 Win=28960 Len=0 MSS=1460 SACK_PERM=1 TSval=3129320577 TSecr=0 WS=128"
"61","39.016376","192.168.137.22","23.64.80.77","TCP","66","55129  >  443 [ACK] Seq=1 Ack=1 Win=65535 Len=0 TSval=0 TSecr=3129320577"
"62","39.018622","192.168.137.22","23.64.80.77","TLSv1.1","126","Client Hello"
"63","39.052238","23.64.80.77","192.168.137.22","TCP","66","443  >  55129 [ACK] Seq=1 Ack=61 Win=29056 Len=0 TSval=3129320613 TSecr=0"
"64","39.052271","23.64.80.77","192.168.137.22","TCP","66","[TCP Dup ACK 63#1] 443  >  55129 [ACK] Seq=1 Ack=61 Win=29056 Len=0 TSval=3129320613 TSecr=0"
"65","39.052296","23.64.80.77","192.168.137.22","TLSv1.1","1514","Server Hello"
"66","39.053878","23.64.80.77","192.168.137.22","TLSv1.1","823","Certificate, Server Hello Done"
"67","39.056364","192.168.137.22","23.64.80.77","TCP","66","55129  >  443 [ACK] Seq=61 Ack=2206 Win=64943 Len=0 TSval=0 TSecr=3129320613"
"68","39.139897","192.168.137.22","23.64.80.77","TLSv1.1","408","Client Key Exchange, Change Cipher Spec, Encrypted Handshake Message"
"69","39.172076","23.64.80.77","192.168.137.22","TLSv1.1","141","Change Cipher Spec, Encrypted Handshake Message"
"70","39.175194","192.168.137.22","23.64.80.77","TLSv1.1","359","Application Data"
"71","39.207473","23.64.80.77","192.168.137.22","TCP","1514","443  >  55129 [ACK] Seq=2281 Ack=696 Win=31104 Len=1448 TSval=3129320769 TSecr=0 [TCP segment of a reassembled PDU]"
"72","39.207512","23.64.80.77","192.168.137.22","TLSv1.1","591","Application Data"
"73","39.207527","23.64.80.77","192.168.137.22","TLSv1.1","119","Encrypted Alert"
"74","39.207539","23.64.80.77","192.168.137.22","TCP","66","443  >  55129 [FIN, ACK] Seq=4307 Ack=696 Win=31104 Len=0 TSval=3129320769 TSecr=0"
"75","39.210043","192.168.137.22","23.64.80.77","TCP","66","55129  >  443 [ACK] Seq=696 Ack=4254 Win=63727 Len=0 TSval=0 TSecr=3129320769"
"76","39.210043","192.168.137.22","23.64.80.77","TCP","66","55129  >  443 [ACK] Seq=696 Ack=4308 Win=63674 Len=0 TSval=0 TSecr=3129320769"
"77","39.211217","192.168.137.22","23.64.80.77","TLSv1.1","119","Encrypted Alert"
"78","39.211964","192.168.137.22","23.64.80.77","TCP","66","55129  >  443 [FIN, ACK] Seq=749 Ack=4308 Win=65535 Len=0 TSval=0 TSecr=3129320769"
"79","39.244896","23.64.80.77","192.168.137.22","TCP","54","443  >  55129 [RST] Seq=4308 Win=0 Len=0"
"80","39.244920","23.64.80.77","192.168.137.22","TCP","54","443  >  55129 [RST] Seq=4308 Win=0 Len=0"
"81","40.003090","192.168.137.22","44.227.237.70","TLSv1.1","119","Application Data"
"82","40.095829","44.227.237.70","192.168.137.22","TCP","66","5223  >  55513 [ACK] Seq=518 Ack=352 Win=416 Len=0 TSval=3472210900 TSecr=22803"
"83","40.481881","192.168.137.22","44.227.237.70","TLSv1.1","471","Application Data"
"84","40.574386","44.227.237.70","192.168.137.22","TCP","66","5223  >  55513 [ACK] Seq=518 Ack=757 Win=421 Len=0 TSval=3472211379 TSecr=22804"
"85","40.958068","192.168.137.22","192.168.137.1","DNS","86","Standard query 0x11a9 A us.np.stun.playstation.net"
"86","40.978914","192.168.137.1","192.168.137.22","DNS","133","Standard query response 0x11a9 A us.np.stun.playstation.net CNAME stun.ww.np.cn.s0.playstation.net A 52.40.62.80"
"87","40.982331","192.168.137.22","239.255.255.250","SSDP","179","M-SEARCH * HTTP/1.1 "
"88","40.986388","192.168.137.22","192.168.137.1","DNS","104","Standard query 0x0599 A static-resource.np.community.playstation.net"
"89","41.006348","192.168.137.1","192.168.137.22","DNS","220","Standard query response 0x0599 A static-resource.np.community.playstation.net CNAME static-resource.np.community.playstation.net.edgekey.net CNAME e6234.g.akamaiedge.net A 23.195.100.205"
"90","41.008866","192.168.137.22","23.195.100.205","TCP","78","55128  >  80 [SYN] Seq=0 Win=65535 Len=0 MSS=1460 WS=1 SACK_PERM=1 TSval=0 TSecr=0"
"91","41.035795","23.195.100.205","192.168.137.22","TCP","74","80  >  55128 [SYN, ACK] Seq=0 Ack=1 Win=28960 Len=0 MSS=1460 SACK_PERM=1 TSval=1553668559 TSecr=0 WS=128"
"92","41.038279","192.168.137.22","23.195.100.205","TCP","66","55128  >  80 [ACK] Seq=1 Ack=1 Win=65535 Len=0 TSval=0 TSecr=1553668559"
"93","41.038279","192.168.137.22","23.195.100.205","HTTP","271","GET /np/resource/psp2-title/NPWR04288_00/matching/NPWR04288_00-matching.xml HTTP/1.1 "
"94","41.074476","23.195.100.205","192.168.137.22","TCP","66","80  >  55128 [ACK] Seq=1 Ack=206 Win=30080 Len=0 TSval=1553668598 TSecr=0"
"95","41.103810","23.195.100.205","192.168.137.22","HTTP/XML","648","HTTP/1.1 200 OK "
"96","41.106622","192.168.137.22","23.195.100.205","TCP","66","55128  >  80 [FIN, ACK] Seq=206 Ack=583 Win=65535 Len=0 TSval=0 TSecr=1553668626"
"97","41.107024","192.168.137.22","192.168.137.1","DNS","102","Standard query 0x1e8d A agent-22001.ww.np.matching.playstation.net"
"98","41.132962","192.168.137.1","192.168.137.22","DNS","182","Standard query response 0x1e8d A agent-22001.ww.np.matching.playstation.net CNAME elb001-mtc-ag20.mtc.usw2.np.cy.s0.playstation.net A 54.68.83.171 A 52.39.46.143"
"99","41.135639","192.168.137.22","54.68.83.171","TCP","78","55127  >  3478 [SYN] Seq=0 Win=65535 Len=0 MSS=1460 WS=1 SACK_PERM=1 TSval=0 TSecr=0"
"100","41.142519","23.195.100.205","192.168.137.22","TCP","66","80  >  55128 [FIN, ACK] Seq=583 Ack=207 Win=30080 Len=0 TSval=1553668666 TSecr=0"
"101","41.144727","192.168.137.22","23.195.100.205","TCP","66","55128  >  80 [ACK] Seq=207 Ack=584 Win=65535 Len=0 TSval=0 TSecr=1553668666"
"102","41.233120","54.68.83.171","192.168.137.22","TCP","74","3478  >  55127 [SYN, ACK] Seq=0 Ack=1 Win=17898 Len=0 MSS=1460 SACK_PERM=1 TSval=2752042611 TSecr=0 WS=128"
"103","41.235580","192.168.137.22","54.68.83.171","TCP","66","55127  >  3478 [ACK] Seq=1 Ack=1 Win=65535 Len=0 TSval=0 TSecr=2752042611"
"104","41.235580","192.168.137.22","54.68.83.171","TCP","120","55127  >  3478 [PSH, ACK] Seq=1 Ack=1 Win=65535 Len=54 TSval=0 TSecr=2752042611 [TCP segment of a reassembled PDU]"
"105","41.337583","54.68.83.171","192.168.137.22","TCP","66","3478  >  55127 [ACK] Seq=1 Ack=55 Win=17920 Len=0 TSval=2752042716 TSecr=0"
"106","41.337610","54.68.83.171","192.168.137.22","TCP","105","3478  >  55127 [PSH, ACK] Seq=1 Ack=55 Win=17920 Len=39 TSval=2752042716 TSecr=0 [TCP segment of a reassembled PDU]"
"107","41.436086","192.168.137.22","54.68.83.171","TCP","78","55126  >  443 [SYN] Seq=0 Win=65535 Len=0 MSS=1460 WS=1 SACK_PERM=1 TSval=0 TSecr=0"
"108","41.532376","54.68.83.171","192.168.137.22","TCP","74","443  >  55126 [SYN, ACK] Seq=0 Ack=1 Win=17898 Len=0 MSS=1460 SACK_PERM=1 TSval=2745535482 TSecr=0 WS=128"
"109","41.535052","192.168.137.22","54.68.83.171","TCP","66","55126  >  443 [ACK] Seq=1 Ack=1 Win=65535 Len=0 TSval=0 TSecr=2745535482"
"110","41.536636","192.168.137.22","54.68.83.171","TLSv1.1","126","Client Hello"
"111","41.537308","192.168.137.22","54.68.83.171","TCP","66","55127  >  3478 [ACK] Seq=55 Ack=40 Win=65535 Len=0 TSval=1 TSecr=2752042716"
"112","41.637331","54.68.83.171","192.168.137.22","TCP","105","[TCP Spurious Retransmission] 3478  >  55127 [PSH, ACK] Seq=1 Ack=55 Win=17920 Len=39 TSval=2752043016 TSecr=0"
"113","41.639999","54.68.83.171","192.168.137.22","TCP","66","443  >  55126 [ACK] Seq=1 Ack=61 Win=17920 Len=0 TSval=2745535591 TSecr=0"
"114","41.640045","54.68.83.171","192.168.137.22","TLSv1.1","1282","Server Hello, Certificate, Server Hello Done"
"115","41.640971","192.168.137.22","54.68.83.171","TCP","78","[TCP Dup ACK 111#1] 55127  >  3478 [ACK] Seq=55 Ack=40 Win=65535 Len=0 TSval=1 TSecr=2752042716 SLE=1 SRE=40"
"116","41.703566","192.168.137.22","54.68.83.171","TLSv1.1","408","Client Key Exchange, Change Cipher Spec, Encrypted Handshake Message"
"117","41.807372","54.68.83.171","192.168.137.22","TLSv1.1","141","Change Cipher Spec, Encrypted Handshake Message"
"118","41.812102","192.168.137.22","54.68.83.171","TLSv1.1","887","Application Data"
"119","41.821918","192.168.137.22","23.195.100.205","TCP","78","55125  >  80 [SYN] Seq=0 Win=65535 Len=0 MSS=1460 WS=1 SACK_PERM=1 TSval=0 TSecr=0"
"120","41.853141","23.195.100.205","192.168.137.22","TCP","74","80  >  55125 [SYN, ACK] Seq=0 Ack=1 Win=28960 Len=0 MSS=1460 SACK_PERM=1 TSval=1553669375 TSecr=0 WS=128"
"121","41.856051","192.168.137.22","23.195.100.205","TCP","66","55125  >  80 [ACK] Seq=1 Ack=1 Win=65535 Len=0 TSval=1 TSecr=1553669375"
"122","41.856051","192.168.137.22","23.195.100.205","HTTP","271","GET /np/resource/psp2-title/NPWR03718_00/matching/NPWR03718_00-matching.xml HTTP/1.1 "
"123","41.889651","23.195.100.205","192.168.137.22","TCP","66","80  >  55125 [ACK] Seq=1 Ack=206 Win=30080 Len=0 TSval=1553669412 TSecr=1"
"124","41.925017","23.195.100.205","192.168.137.22","HTTP/XML","648","HTTP/1.1 200 OK "
"125","41.928265","192.168.137.22","23.195.100.205","TCP","66","55125  >  80 [FIN, ACK] Seq=206 Ack=583 Win=65535 Len=0 TSval=1 TSecr=1553669447"
"126","41.928265","192.168.137.22","54.68.83.171","TCP","78","55124  >  3478 [SYN] Seq=0 Win=65535 Len=0 MSS=1460 WS=1 SACK_PERM=1 TSval=0 TSecr=0"
"127","41.930187","54.68.83.171","192.168.137.22","TLSv1.1","327","Application Data"
"128","41.957441","23.195.100.205","192.168.137.22","TCP","66","80  >  55125 [FIN, ACK] Seq=583 Ack=207 Win=30080 Len=0 TSval=1553669479 TSecr=1"
"129","41.959811","192.168.137.22","23.195.100.205","TCP","66","55125  >  80 [ACK] Seq=207 Ack=584 Win=65535 Len=0 TSval=1 TSecr=1553669479"
"130","41.982841","192.168.137.22","239.255.255.250","SSDP","179","M-SEARCH * HTTP/1.1 "
"131","42.025150","54.68.83.171","192.168.137.22","TCP","74","3478  >  55124 [SYN, ACK] Seq=0 Ack=1 Win=17898 Len=0 MSS=1460 SACK_PERM=1 TSval=2745535975 TSecr=0 WS=128"
"132","42.027710","192.168.137.22","54.68.83.171","TCP","66","55124  >  3478 [ACK] Seq=1 Ack=1 Win=65535 Len=0 TSval=0 TSecr=2745535975"
"133","42.027710","192.168.137.22","54.68.83.171","TCP","120","55124  >  3478 [PSH, ACK] Seq=1 Ack=1 Win=65535 Len=54 TSval=0 TSecr=2745535975 [TCP segment of a reassembled PDU]"
"134","42.127190","192.168.137.22","54.68.83.171","TCP","66","55126  >  443 [ACK] Seq=1224 Ack=1553 Win=65439 Len=0 TSval=1 TSecr=2745535880"
"135","42.130228","54.68.83.171","192.168.137.22","TCP","66","3478  >  55124 [ACK] Seq=1 Ack=55 Win=17920 Len=0 TSval=2745536080 TSecr=0"
"136","42.130258","54.68.83.171","192.168.137.22","TCP","105","3478  >  55124 [PSH, ACK] Seq=1 Ack=55 Win=17920 Len=39 TSval=2745536080 TSecr=0 [TCP segment of a reassembled PDU]"
"137","42.228245","192.168.137.22","54.68.83.171","TLSv1.1","119","Encrypted Alert"
"138","42.228758","192.168.137.22","54.68.83.171","TCP","66","55126  >  443 [FIN, ACK] Seq=1277 Ack=1553 Win=65535 Len=0 TSval=1 TSecr=2745535880"
"139","42.229512","192.168.137.22","54.68.83.171","TCP","78","55123  >  443 [SYN] Seq=0 Win=65535 Len=0 MSS=1460 WS=1 SACK_PERM=1 TSval=0 TSecr=0"
"140","42.324633","54.68.83.171","192.168.137.22","TCP","78","[TCP Dup ACK 127#1] 443  >  55126 [ACK] Seq=1553 Ack=1224 Win=20736 Len=0 TSval=2745536274 TSecr=1 SLE=1277 SRE=1278"
"141","42.327338","192.168.137.22","54.68.83.171","TCP","66","55124  >  3478 [ACK] Seq=55 Ack=40 Win=65535 Len=0 TSval=0 TSecr=2745536080"
"142","42.329366","54.68.83.171","192.168.137.22","TCP","74","443  >  55123 [SYN, ACK] Seq=0 Ack=1 Win=17898 Len=0 MSS=1460 SACK_PERM=1 TSval=2751951640 TSecr=0 WS=128"
"143","42.329392","54.68.83.171","192.168.137.22","TCP","66","443  >  55126 [ACK] Seq=1553 Ack=1278 Win=20736 Len=0 TSval=2745536279 TSecr=1"
"144","42.329405","54.68.83.171","192.168.137.22","TCP","66","443  >  55126 [FIN, ACK] Seq=1553 Ack=1278 Win=20736 Len=0 TSval=2745536279 TSecr=1"
"145","42.331625","192.168.137.22","54.68.83.171","TCP","66","55123  >  443 [ACK] Seq=1 Ack=1 Win=65535 Len=0 TSval=0 TSecr=2751951640"
"146","42.331625","192.168.137.22","54.68.83.171","TCP","66","55126  >  443 [ACK] Seq=1278 Ack=1554 Win=65535 Len=0 TSval=1 TSecr=2745536279"
"147","42.333772","192.168.137.22","54.68.83.171","TLSv1.1","126","Client Hello"
"148","42.428516","54.68.83.171","192.168.137.22","TCP","105","[TCP Spurious Retransmission] 3478  >  55124 [PSH, ACK] Seq=1 Ack=55 Win=17920 Len=39 TSval=2745536380 TSecr=0"
"149","42.430905","192.168.137.22","54.68.83.171","TCP","78","[TCP Dup ACK 141#1] 55124  >  3478 [ACK] Seq=55 Ack=40 Win=65535 Len=0 TSval=1 TSecr=2745536080 SLE=1 SRE=40"
"150","42.431701","54.68.83.171","192.168.137.22","TCP","66","443  >  55123 [ACK] Seq=1 Ack=61 Win=17920 Len=0 TSval=2751951744 TSecr=0"
"151","42.431722","54.68.83.171","192.168.137.22","TLSv1.1","1282","Server Hello, Certificate, Server Hello Done"
"152","42.436488","54.68.83.171","192.168.137.22","TCP","66","[TCP Dup ACK 150#1] 443  >  55123 [ACK] Seq=1217 Ack=61 Win=17920 Len=0 TSval=2751951749 TSecr=0"
"153","42.447045","35.161.195.31","192.168.137.22","TLSv1.1","439","Application Data"
"154","42.496970","192.168.137.22","54.68.83.171","TLSv1.1","408","Client Key Exchange, Change Cipher Spec, Encrypted Handshake Message"
"155","42.599589","54.68.83.171","192.168.137.22","TLSv1.1","141","Change Cipher Spec, Encrypted Handshake Message"
"156","42.607350","192.168.137.22","54.68.83.171","TLSv1.1","887","Application Data"
"157","42.647128","192.168.137.22","35.161.195.31","TCP","66","55485  >  443 [ACK] Seq=54 Ack=736 Win=65535 Len=0 TSval=22794 TSecr=3187182709"
"158","42.727683","54.68.83.171","192.168.137.22","TLSv1.1","327","Application Data"
"159","42.808253","192.168.137.22","54.68.83.171","TLSv1.1","119","Encrypted Alert"
"160","42.808253","192.168.137.22","54.68.83.171","TCP","66","55123  >  443 [FIN, ACK] Seq=1277 Ack=1553 Win=65535 Len=0 TSval=1 TSecr=2751952039"
"161","42.825039","192.168.137.22","192.168.137.1","DNS","104","Standard query 0x662e A static-resource.np.community.playstation.net"
"162","42.850235","192.168.137.1","192.168.137.22","DNS","220","Standard query response 0x662e A static-resource.np.community.playstation.net CNAME static-resource.np.community.playstation.net.edgekey.net CNAME e6234.g.akamaiedge.net A 23.195.100.205"
"163","42.857860","192.168.137.22","23.195.100.205","TCP","78","55122  >  80 [SYN] Seq=0 Win=65535 Len=0 MSS=1460 WS=1 SACK_PERM=1 TSval=0 TSecr=0"
"164","42.886739","23.195.100.205","192.168.137.22","TCP","74","80  >  55122 [SYN, ACK] Seq=0 Ack=1 Win=28960 Len=0 MSS=1460 SACK_PERM=1 TSval=3675921939 TSecr=0 WS=128"
"165","42.889184","192.168.137.22","23.195.100.205","TCP","66","55122  >  80 [ACK] Seq=1 Ack=1 Win=65535 Len=0 TSval=0 TSecr=3675921939"
"166","42.889184","192.168.137.22","23.195.100.205","HTTP","290","GET /np/resource/psp2-title/NPWR04288_00/storage/NPWR04288_00-storage.xml HTTP/1.1 "
"167","42.906102","54.68.83.171","192.168.137.22","TCP","78","[TCP Dup ACK 158#1] 443  >  55123 [ACK] Seq=1553 Ack=1224 Win=20736 Len=0 TSval=2751952218 TSecr=1 SLE=1277 SRE=1278"
"168","42.911087","54.68.83.171","192.168.137.22","TCP","66","443  >  55123 [ACK] Seq=1553 Ack=1278 Win=20736 Len=0 TSval=2751952224 TSecr=1"
"169","42.911113","54.68.83.171","192.168.137.22","TCP","66","443  >  55123 [FIN, ACK] Seq=1553 Ack=1278 Win=20736 Len=0 TSval=2751952224 TSecr=1"
"170","42.913314","192.168.137.22","54.68.83.171","TCP","66","55123  >  443 [ACK] Seq=1278 Ack=1554 Win=65535 Len=0 TSval=2 TSecr=2751952224"
"171","42.924962","23.195.100.205","192.168.137.22","TCP","66","80  >  55122 [ACK] Seq=1 Ack=225 Win=30080 Len=0 TSval=3675921976 TSecr=0"
"172","42.925121","23.195.100.205","192.168.137.22","HTTP/XML","617","HTTP/1.1 200 OK "
"173","42.927694","192.168.137.22","23.195.100.205","TCP","66","55122  >  80 [FIN, ACK] Seq=225 Ack=552 Win=65535 Len=0 TSval=0 TSecr=3675921977"
"174","42.930939","192.168.137.22","192.168.137.1","DNS","101","Standard query 0x174c A storage01.ww.np.community.playstation.net"
"175","42.950241","192.168.137.1","192.168.137.22","DNS","220","Standard query response 0x174c A storage01.ww.np.community.playstation.net CNAME 19188-wildcard.ww.np.community.playstation.net.edgekey.net CNAME e19188.b.akamaiedge.net A 23.193.41.220"
"176","42.955952","192.168.137.22","23.193.41.220","TCP","78","55121  >  443 [SYN] Seq=0 Win=65535 Len=0 MSS=1460 WS=1 SACK_PERM=1 TSval=0 TSecr=0"
"177","42.959735","23.195.100.205","192.168.137.22","TCP","66","80  >  55122 [FIN, ACK] Seq=552 Ack=226 Win=30080 Len=0 TSval=3675922012 TSecr=0"
"178","42.962113","192.168.137.22","23.195.100.205","TCP","66","55122  >  80 [ACK] Seq=226 Ack=553 Win=65535 Len=0 TSval=0 TSecr=3675922012"
"179","42.982448","23.193.41.220","192.168.137.22","TCP","74","443  >  55121 [SYN, ACK] Seq=0 Ack=1 Win=28960 Len=0 MSS=1460 SACK_PERM=1 TSval=4009037990 TSecr=0 WS=128"
"180","42.983491","192.168.137.22","239.255.255.250","SSDP","179","M-SEARCH * HTTP/1.1 "
"181","42.984803","192.168.137.22","23.193.41.220","TCP","66","55121  >  443 [ACK] Seq=1 Ack=1 Win=65535 Len=0 TSval=0 TSecr=4009037990"
"182","42.989620","192.168.137.22","23.193.41.220","TLSv1.1","126","Client Hello"
"183","43.013654","23.193.41.220","192.168.137.22","TCP","66","443  >  55121 [ACK] Seq=1 Ack=61 Win=29056 Len=0 TSval=4009038020 TSecr=0"
"184","43.013693","23.193.41.220","192.168.137.22","TLSv1.1","1514","Server Hello"
"185","43.013709","23.193.41.220","192.168.137.22","TCP","1514","443  >  55121 [ACK] Seq=1449 Ack=61 Win=29056 Len=1448 TSval=4009038020 TSecr=0 [TCP segment of a reassembled PDU]"
"186","43.015329","23.193.41.220","192.168.137.22","TCP","1266","443  >  55121 [PSH, ACK] Seq=2897 Ack=61 Win=29056 Len=1200 TSval=4009038020 TSecr=0 [TCP segment of a reassembled PDU]"
"187","43.015353","23.193.41.220","192.168.137.22","TLSv1.1","780","Certificate, Server Hello Done"
"188","43.016191","192.168.137.22","23.193.41.220","TCP","66","55121  >  443 [ACK] Seq=61 Ack=2897 Win=62804 Len=0 TSval=0 TSecr=4009038020"
"189","43.017852","192.168.137.22","23.193.41.220","TCP","66","55121  >  443 [ACK] Seq=61 Ack=4811 Win=63786 Len=0 TSval=0 TSecr=4009038020"
"190","43.107216","192.168.137.22","23.193.41.220","TLSv1.1","408","Client Key Exchange, Change Cipher Spec, Encrypted Handshake Message"
"191","43.136414","23.193.41.220","192.168.137.22","TLSv1.1","141","Change Cipher Spec, Encrypted Handshake Message"
"192","43.140154","192.168.137.22","23.193.41.220","TLSv1.1","407","Application Data"
"193","43.140846","192.168.137.22","23.193.41.220","TLSv1.1","1207","Application Data"
"194","43.164649","23.193.41.220","192.168.137.22","TCP","66","443  >  55121 [ACK] Seq=4886 Ack=1885 Win=33408 Len=0 TSval=4009038172 TSecr=0"
"195","43.281513","23.193.41.220","192.168.137.22","TLSv1.1","503","Application Data"
"196","43.284612","192.168.137.22","23.193.41.220","TLSv1.1","119","Encrypted Alert"
"197","43.290631","192.168.137.22","23.193.41.220","TCP","66","55121  >  443 [FIN, ACK] Seq=1938 Ack=5323 Win=65535 Len=0 TSval=0 TSecr=4009038288"
"198","43.293242","192.168.137.22","192.168.137.1","DNS","87","Standard query 0xdce9 A a0.ww.np.dl.playstation.net"
"199","43.310778","23.193.41.220","192.168.137.22","TCP","78","[TCP Dup ACK 194#1] 443  >  55121 [ACK] Seq=5323 Ack=1885 Win=33408 Len=0 TSval=4009038316 TSecr=0 SLE=1938 SRE=1939"
"200","43.314820","23.193.41.220","192.168.137.22","TCP","66","443  >  55121 [ACK] Seq=5323 Ack=1939 Win=33408 Len=0 TSval=4009038321 TSecr=0"
"201","43.314842","23.193.41.220","192.168.137.22","TLSv1.1","119","Encrypted Alert"
"202","43.314854","23.193.41.220","192.168.137.22","TCP","66","443  >  55121 [FIN, ACK] Seq=5376 Ack=1939 Win=33408 Len=0 TSval=4009038321 TSecr=0"
"203","43.314986","192.168.137.1","192.168.137.22","DNS","188","Standard query response 0xdce9 A a0.ww.np.dl.playstation.net CNAME wild.ww.np.dl.playstation.net.edgekey.net CNAME e1800.d.akamaiedge.net A 23.64.80.77"
"204","43.317052","192.168.137.22","23.193.41.220","TCP","60","55121  >  443 [RST] Seq=1939 Win=0 Len=0"
"205","43.317052","192.168.137.22","23.193.41.220","TCP","60","55121  >  443 [RST] Seq=1939 Win=0 Len=0"
"206","43.317052","192.168.137.22","23.64.80.77","TCP","78","55120  >  443 [SYN] Seq=0 Win=65535 Len=0 MSS=1460 WS=1 SACK_PERM=1 TSval=0 TSecr=0"
"207","43.355069","23.64.80.77","192.168.137.22","TCP","74","443  >  55120 [SYN, ACK] Seq=0 Ack=1 Win=28960 Len=0 MSS=1460 SACK_PERM=1 TSval=3129324917 TSecr=0 WS=128"
"208","43.357622","192.168.137.22","23.64.80.77","TCP","66","55120  >  443 [ACK] Seq=1 Ack=1 Win=65535 Len=0 TSval=1 TSecr=3129324917"
"209","43.358691","192.168.137.22","23.64.80.77","TLSv1.1","126","Client Hello"
"210","43.395644","23.64.80.77","192.168.137.22","TCP","66","443  >  55120 [ACK] Seq=1 Ack=61 Win=29056 Len=0 TSval=3129324958 TSecr=1"
"211","43.395673","23.64.80.77","192.168.137.22","TLSv1.1","1514","Server Hello"
"212","43.395699","23.64.80.77","192.168.137.22","TLSv1.1","823","Certificate, Server Hello Done"
"213","43.398331","192.168.137.22","23.64.80.77","TCP","66","55120  >  443 [ACK] Seq=61 Ack=2206 Win=63495 Len=0 TSval=1 TSecr=3129324958"
"214","43.483552","192.168.137.22","23.64.80.77","TLSv1.1","408","Client Key Exchange, Change Cipher Spec, Encrypted Handshake Message"
"215","43.517287","23.64.80.77","192.168.137.22","TLSv1.1","141","Change Cipher Spec, Encrypted Handshake Message"
"216","43.523934","192.168.137.22","23.64.80.77","TLSv1.1","295","Application Data"
"217","43.564441","23.64.80.77","192.168.137.22","TLSv1.1","471","Application Data"
"218","43.567536","192.168.137.22","23.64.80.77","TLSv1.1","119","Encrypted Alert"
"219","43.568280","192.168.137.22","23.64.80.77","TCP","66","55120  >  443 [FIN, ACK] Seq=685 Ack=2686 Win=65535 Len=0 TSval=1 TSecr=3129325126"
"220","43.601724","23.64.80.77","192.168.137.22","TLSv1.1","119","Encrypted Alert"
"221","43.601753","23.64.80.77","192.168.137.22","TCP","66","443  >  55120 [FIN, ACK] Seq=2739 Ack=685 Win=31104 Len=0 TSval=3129325164 TSecr=1"
"222","43.605134","192.168.137.22","23.64.80.77","TCP","60","55120  >  443 [RST] Seq=685 Win=0 Len=0"
"223","43.605134","192.168.137.22","23.64.80.77","TCP","60","55120  >  443 [RST] Seq=685 Win=0 Len=0"
"224","43.607162","23.64.80.77","192.168.137.22","TCP","66","443  >  55120 [ACK] Seq=2740 Ack=686 Win=31104 Len=0 TSval=3129325169 TSecr=1"
"225","43.609582","192.168.137.22","23.64.80.77","TCP","60","55120  >  443 [RST] Seq=686 Win=0 Len=0"
"226","43.983616","192.168.137.22","239.255.255.250","SSDP","179","M-SEARCH * HTTP/1.1 "
"227","44.985295","192.168.137.22","239.255.255.250","SSDP","179","M-SEARCH * HTTP/1.1 "
"228","45.460443","192.168.137.1","192.168.137.255","UDP","86","57621  >  57621 Len=44"
"229","45.985726","192.168.137.22","52.40.62.80","CLASSIC-STUN","98","Message: Binding Request"
"230","46.080943","52.40.62.80","192.168.137.22","CLASSIC-STUN","122","Message: Binding Response"
"231","46.083386","192.168.137.22","52.40.62.80","CLASSIC-STUN","98","Message: Binding Request"
"232","46.128851","Dell_c7:e0:05","Broadcast","ARP","42","Who has 10.0.0.1? Tell 192.168.137.1"
"233","46.193978","52.40.62.80","192.168.137.22","CLASSIC-STUN","122","Message: Binding Response"
"234","46.196462","192.168.137.22","52.40.62.81","CLASSIC-STUN","98","Message: Binding Request"
"235","46.296217","52.40.62.81","192.168.137.22","CLASSIC-STUN","122","Message: Binding Response"
"236","46.829806","192.168.137.22","35.161.195.31","TLSv1.1","119","Application Data"
"237","46.910506","Dell_c7:e0:05","Broadcast","ARP","42","Who has 10.0.0.1? Tell 192.168.137.1"
"238","46.924828","35.161.195.31","192.168.137.22","TLSv1.1","119","Application Data"
"239","47.117040","192.168.137.22","35.161.195.31","TCP","66","55485  >  443 [ACK] Seq=107 Ack=789 Win=65535 Len=0 TSval=22803 TSecr=3187187187"
"240","47.527465","192.168.137.22","54.68.83.171","TCP","98","55124  >  3478 [PSH, ACK] Seq=55 Ack=40 Win=65535 Len=32 TSval=11 TSecr=2745536080 [TCP segment of a reassembled PDU]"
"241","47.628367","54.68.83.171","192.168.137.22","TCP","128","3478  >  55124 [PSH, ACK] Seq=40 Ack=87 Win=17920 Len=62 TSval=2745541575 TSecr=11 [TCP segment of a reassembled PDU]"
"242","47.828841","192.168.137.22","54.68.83.171","TCP","66","55124  >  3478 [ACK] Seq=87 Ack=102 Win=65535 Len=0 TSval=11 TSecr=2745541575"
"243","47.920193","Dell_c7:e0:05","Broadcast","ARP","42","Who has 10.0.0.1? Tell 192.168.137.1"
"244","49.326342","192.168.137.22","54.68.83.171","TCP","67","55127  >  3478 [PSH, ACK] Seq=55 Ack=40 Win=65535 Len=1 TSval=16 TSecr=2752042716 [TCP segment of a reassembled PDU]"
"245","49.464272","54.68.83.171","192.168.137.22","TCP","66","3478  >  55127 [ACK] Seq=40 Ack=56 Win=17920 Len=0 TSval=2752050842 TSecr=16"
"246","49.826520","192.168.137.22","54.68.83.171","TCP","240","55124  >  3478 [PSH, ACK] Seq=87 Ack=102 Win=65535 Len=174 TSval=15 TSecr=2745541575 [TCP segment of a reassembled PDU]"
"247","49.930122","54.68.83.171","192.168.137.22","TCP","110","3478  >  55124 [PSH, ACK] Seq=102 Ack=261 Win=19072 Len=44 TSval=2745543881 TSecr=15 [TCP segment of a reassembled PDU]"
"248","49.966164","54.68.83.171","192.168.137.22","TCP","67","3478  >  55127 [PSH, ACK] Seq=40 Ack=56 Win=17920 Len=1 TSval=2752051344 TSecr=16 [TCP segment of a reassembled PDU]"
"249","50.084526","192.168.137.22","54.68.83.171","TCP","67","55124  >  3478 [PSH, ACK] Seq=261 Ack=146 Win=65535 Len=1 TSval=16 TSecr=2745543881 [TCP segment of a reassembled PDU]"
"250","50.084526","192.168.137.22","54.68.83.171","TCP","104","55124  >  3478 [PSH, ACK] Seq=262 Ack=146 Win=65535 Len=38 TSval=16 TSecr=2745543881 [TCP segment of a reassembled PDU]"
"251","50.166857","192.168.137.22","54.68.83.171","TCP","66","55127  >  3478 [ACK] Seq=56 Ack=41 Win=65535 Len=0 TSval=18 TSecr=2752051344"
"252","50.188002","54.68.83.171","192.168.137.22","TCP","78","[TCP Dup ACK 247#1] 3478  >  55124 [ACK] Seq=146 Ack=261 Win=19072 Len=0 TSval=2745544139 TSecr=15 SLE=262 SRE=300"
"253","50.188026","54.68.83.171","192.168.137.22","TCP","66","3478  >  55124 [ACK] Seq=146 Ack=300 Win=19072 Len=0 TSval=2745544139 TSecr=16"
"254","50.201010","54.68.83.171","192.168.137.22","TCP","264","3478  >  55124 [PSH, ACK] Seq=146 Ack=300 Win=19072 Len=198 TSval=2745544152 TSecr=16 [TCP segment of a reassembled PDU]"
"255","50.285447","192.168.137.22","192.168.137.1","DNS","103","Standard query 0x617f A lookup-22001.ww.np.matching.playstation.net"
"256","50.306132","192.168.137.1","192.168.137.22","DNS","119","Standard query response 0x617f A lookup-22001.ww.np.matching.playstation.net A 52.37.139.66"
"257","50.308370","192.168.137.22","52.37.139.66","TCP","78","55119  >  3479 [SYN] Seq=0 Win=65535 Len=0 MSS=1460 WS=1 SACK_PERM=1 TSval=0 TSecr=0"
"258","50.396778","192.168.137.22","54.68.83.171","TCP","66","55124  >  3478 [ACK] Seq=300 Ack=344 Win=65535 Len=0 TSval=17 TSecr=2745544152"
"259","50.405265","52.37.139.66","192.168.137.22","TCP","74","3479  >  55119 [SYN, ACK] Seq=0 Ack=1 Win=17898 Len=0 MSS=1460 SACK_PERM=1 TSval=2749588114 TSecr=0 WS=128"
"260","50.407707","192.168.137.22","52.37.139.66","TCP","66","55119  >  3479 [ACK] Seq=1 Ack=1 Win=65535 Len=0 TSval=1 TSecr=2749588114"
"261","50.407707","192.168.137.22","52.37.139.66","TCP","251","55119  >  3479 [PSH, ACK] Seq=1 Ack=1 Win=65535 Len=185 TSval=1 TSecr=2749588114"
"262","50.507728","52.37.139.66","192.168.137.22","TCP","66","3479  >  55119 [ACK] Seq=1 Ack=186 Win=19072 Len=0 TSval=2749588216 TSecr=1"
"263","50.507763","52.37.139.66","192.168.137.22","TCP","916","3479  >  55119 [PSH, ACK] Seq=1 Ack=186 Win=19072 Len=850 TSval=2749588216 TSecr=1"
"264","50.607970","192.168.137.22","52.37.139.66","TCP","66","55119  >  3479 [FIN, ACK] Seq=186 Ack=851 Win=65535 Len=0 TSval=1 TSecr=2749588216"
"265","50.702163","52.37.139.66","192.168.137.22","TCP","66","3479  >  55119 [FIN, ACK] Seq=851 Ack=187 Win=19072 Len=0 TSval=2749588411 TSecr=1"
"266","50.704403","192.168.137.22","52.37.139.66","TCP","66","55119  >  3479 [ACK] Seq=187 Ack=852 Win=65535 Len=0 TSval=1 TSecr=2749588411"
"267","50.809013","192.168.137.22","192.168.137.1","DNS","104","Standard query 0x559a A session-22002.ww.np.matching.playstation.net"
"268","50.828489","192.168.137.1","192.168.137.22","DNS","120","Standard query response 0x559a A session-22002.ww.np.matching.playstation.net A 52.27.10.254"
"269","50.831429","192.168.137.22","52.27.10.254","TCP","78","55118  >  3480 [SYN] Seq=0 Win=65535 Len=0 MSS=1460 WS=1 SACK_PERM=1 TSval=0 TSecr=0"
"270","50.925982","52.27.10.254","192.168.137.22","TCP","74","3480  >  55118 [SYN, ACK] Seq=0 Ack=1 Win=17898 Len=0 MSS=1460 SACK_PERM=1 TSval=2744528966 TSecr=0 WS=128"
"271","50.928519","192.168.137.22","52.27.10.254","TCP","66","55118  >  3480 [ACK] Seq=1 Ack=1 Win=65535 Len=0 TSval=1 TSecr=2744528966"
"272","50.930573","192.168.137.22","52.27.10.254","TCP","355","55118  >  3480 [PSH, ACK] Seq=1 Ack=1 Win=65535 Len=289 TSval=1 TSecr=2744528966"
"273","51.029791","52.27.10.254","192.168.137.22","TCP","66","3480  >  55118 [ACK] Seq=1 Ack=290 Win=19072 Len=0 TSval=2744529069 TSecr=1"
"274","51.029818","52.27.10.254","192.168.137.22","TCP","624","3480  >  55118 [PSH, ACK] Seq=1 Ack=290 Win=19072 Len=558 TSval=2744529069 TSecr=1"
"275","51.226986","192.168.137.22","52.27.10.254","TCP","66","55118  >  3480 [ACK] Seq=290 Ack=559 Win=65535 Len=0 TSval=1 TSecr=2744529069"
"276","51.332588","192.168.137.22","54.68.83.171","TCP","506","55124  >  3478 [PSH, ACK] Seq=300 Ack=344 Win=65535 Len=440 TSval=18 TSecr=2745544152 [TCP segment of a reassembled PDU]"
"277","51.467876","54.68.83.171","192.168.137.22","TCP","66","3478  >  55124 [ACK] Seq=344 Ack=740 Win=20096 Len=0 TSval=2745545419 TSecr=18"
"278","51.483328","54.68.83.171","192.168.137.22","TCP","98","3478  >  55124 [PSH, ACK] Seq=344 Ack=740 Win=20096 Len=32 TSval=2745545434 TSecr=18 [TCP segment of a reassembled PDU]"
"279","51.685388","192.168.137.22","54.68.83.171","TCP","66","55124  >  3478 [ACK] Seq=740 Ack=376 Win=65535 Len=0 TSval=19 TSecr=2745545434"
"280","57.342281","192.168.137.22","54.68.83.171","TCP","67","55127  >  3478 [PSH, ACK] Seq=56 Ack=41 Win=65535 Len=1 TSval=33 TSecr=2752051344 [TCP segment of a reassembled PDU]"
"281","57.441488","54.68.83.171","192.168.137.22","TCP","66","3478  >  55127 [ACK] Seq=41 Ack=57 Win=17920 Len=0 TSval=2752058819 TSecr=33"
"282","57.918038","35.161.195.31","192.168.137.22","TLSv1.1","519","Application Data"
"283","58.116687","192.168.137.22","35.161.195.31","TCP","66","55485  >  443 [ACK] Seq=107 Ack=1242 Win=65535 Len=0 TSval=22825 TSecr=3187198180"
"284","58.143549","192.168.137.22","54.68.83.171","TCP","67","55124  >  3478 [PSH, ACK] Seq=740 Ack=376 Win=65535 Len=1 TSval=32 TSecr=2745545434 [TCP segment of a reassembled PDU]"
"285","58.238643","54.68.83.171","192.168.137.22","TCP","66","3478  >  55124 [ACK] Seq=376 Ack=741 Win=20096 Len=0 TSval=2745552189 TSecr=32"
"286","58.690836","54.68.83.171","192.168.137.22","TCP","67","3478  >  55127 [PSH, ACK] Seq=41 Ack=57 Win=17920 Len=1 TSval=2752060069 TSecr=33 [TCP segment of a reassembled PDU]"
"287","58.886764","192.168.137.22","54.68.83.171","TCP","66","55127  >  3478 [ACK] Seq=57 Ack=42 Win=65535 Len=0 TSval=36 TSecr=2752060069"
"288","58.944966","192.168.137.22","52.27.10.254","TCP","67","55118  >  3480 [PSH, ACK] Seq=290 Ack=559 Win=65535 Len=1 TSval=17 TSecr=2744529069"
"289","59.081449","52.27.10.254","192.168.137.22","TCP","66","3480  >  55118 [ACK] Seq=559 Ack=291 Win=19072 Len=0 TSval=2744537120 TSecr=17"
"290","59.668421","52.27.10.254","192.168.137.22","TCP","67","3480  >  55118 [PSH, ACK] Seq=559 Ack=291 Win=19072 Len=1 TSval=2744537708 TSecr=17"
"291","59.838469","54.68.83.171","192.168.137.22","TCP","67","3478  >  55124 [PSH, ACK] Seq=376 Ack=741 Win=20096 Len=1 TSval=2745553789 TSecr=32 [TCP segment of a reassembled PDU]"
"292","59.866784","192.168.137.22","52.27.10.254","TCP","66","55118  >  3480 [ACK] Seq=291 Ack=560 Win=65535 Len=0 TSval=19 TSecr=2744537708"
"293","60.037017","192.168.137.22","54.68.83.171","TCP","66","55124  >  3478 [ACK] Seq=741 Ack=377 Win=65535 Len=0 TSval=36 TSecr=2745553789"
"294","61.125547","Dell_c7:e0:05","Broadcast","ARP","42","Who has 10.0.0.1? Tell 192.168.137.1"
"295","61.467980","23.193.42.11","192.168.137.22","TLSv1.1","119","Encrypted Alert"
"296","61.468004","23.193.42.11","192.168.137.22","TCP","66","443  >  55131 [FIN, ACK] Seq=3641 Ack=1549 Win=32128 Len=0 TSval=542725008 TSecr=1"
"297","61.470328","192.168.137.22","23.193.42.11","TCP","66","55131  >  443 [ACK] Seq=1549 Ack=3642 Win=65535 Len=0 TSval=117 TSecr=542725008"
"298","61.913057","Dell_c7:e0:05","Broadcast","ARP","42","Who has 10.0.0.1? Tell 192.168.137.1"
"299","62.172639","192.168.137.22","52.27.10.254","TCP","103","55118  >  3480 [PSH, ACK] Seq=291 Ack=560 Win=65535 Len=37 TSval=23 TSecr=2744537708"
"300","62.268071","52.27.10.254","192.168.137.22","TCP","66","3480  >  55118 [ACK] Seq=560 Ack=328 Win=19072 Len=0 TSval=2744540309 TSecr=23"
