"No.","Time","Source","Destination","Protocol","Length","Info"
"1","0.000000","192.168.137.186","192.168.137.1","DNS","86","Standard query 0x9512 A gb.np.stun.playstation.net"
"2","0.022125","192.168.137.1","192.168.137.186","DNS","133","Standard query response 0x9512 A gb.np.stun.playstation.net CNAME stun.ww.np.cn.s0.playstation.net A 52.40.62.52"
"3","0.025428","192.168.137.186","239.255.255.250","SSDP","179","M-SEARCH * HTTP/1.1 "
"4","1.026432","192.168.137.186","239.255.255.250","SSDP","179","M-SEARCH * HTTP/1.1 "
"5","2.026115","192.168.137.186","239.255.255.250","SSDP","179","M-SEARCH * HTTP/1.1 "
"6","3.026666","192.168.137.186","239.255.255.250","SSDP","179","M-SEARCH * HTTP/1.1 "
"7","3.490405","192.168.137.186","192.168.137.1","DNS","91","Standard query 0xc536 A gs-sec.ww.np.dl.playstation.net"
"8","3.514410","192.168.137.1","192.168.137.186","DNS","192","Standard query response 0xc536 A gs-sec.ww.np.dl.playstation.net CNAME wild.ww.np.dl.playstation.net.edgekey.net CNAME e1800.d.akamaiedge.net A 184.28.60.243"
"9","3.516823","192.168.137.186","184.28.60.243","TCP","78","59336  >  443 [SYN] Seq=0 Win=65535 Len=0 MSS=1460 WS=1 SACK_PERM=1 TSval=0 TSecr=0"
"10","3.549078","184.28.60.243","192.168.137.186","TCP","74","443  >  59336 [SYN, ACK] Seq=0 Ack=1 Win=28960 Len=0 MSS=1460 SACK_PERM=1 TSval=3672693230 TSecr=0 WS=128"
"11","3.551271","192.168.137.186","184.28.60.243","TCP","66","59336  >  443 [ACK] Seq=1 Ack=1 Win=65535 Len=0 TSval=0 TSecr=3672693230"
"12","3.554600","192.168.137.186","184.28.60.243","TLSv1.1","126","Client Hello"
"13","3.583644","184.28.60.243","192.168.137.186","TCP","74","[TCP Retransmission] 443  >  59336 [SYN, ACK] Seq=0 Ack=1 Win=28960 Len=0 MSS=1460 SACK_PERM=1 TSval=3672693265 TSecr=0 WS=128"
"14","3.583669","184.28.60.243","192.168.137.186","TCP","66","443  >  59336 [ACK] Seq=1 Ack=61 Win=29056 Len=0 TSval=3672693266 TSecr=0"
"15","3.583681","184.28.60.243","192.168.137.186","TCP","66","[TCP Dup ACK 14#1] 443  >  59336 [ACK] Seq=1 Ack=61 Win=29056 Len=0 TSval=3672693266 TSecr=0"
"16","3.586397","184.28.60.243","192.168.137.186","TLSv1.1","1514","Server Hello"
"17","3.586430","184.28.60.243","192.168.137.186","TLSv1.1","823","Certificate, Server Hello Done"
"18","3.586952","192.168.137.186","184.28.60.243","TCP","78","[TCP Dup ACK 11#1] 59336  >  443 [ACK] Seq=61 Ack=1 Win=65535 Len=0 TSval=0 TSecr=3672693265 SLE=1 SRE=1"
"19","3.589282","192.168.137.186","184.28.60.243","TCP","66","59336  >  443 [ACK] Seq=61 Ack=2206 Win=63495 Len=0 TSval=0 TSecr=3672693267"
"20","3.664992","192.168.137.186","184.28.60.243","TLSv1.1","408","Client Key Exchange, Change Cipher Spec, Encrypted Handshake Message"
"21","3.694979","184.28.60.243","192.168.137.186","TLSv1.1","141","Change Cipher Spec, Encrypted Handshake Message"
"22","3.698652","192.168.137.186","184.28.60.243","TLSv1.1","359","Application Data"
"23","3.729840","184.28.60.243","192.168.137.186","TCP","1514","443  >  59336 [ACK] Seq=2281 Ack=696 Win=31104 Len=1448 TSval=3672693410 TSecr=0 [TCP segment of a reassembled PDU]"
"24","3.729875","184.28.60.243","192.168.137.186","TLSv1.1","1199","Application Data"
"25","3.729889","184.28.60.243","192.168.137.186","TLSv1.1","119","Encrypted Alert"
"26","3.729901","184.28.60.243","192.168.137.186","TCP","66","443  >  59336 [FIN, ACK] Seq=4915 Ack=696 Win=31104 Len=0 TSval=3672693410 TSecr=0"
"27","3.732563","192.168.137.186","184.28.60.243","TCP","66","59336  >  443 [ACK] Seq=696 Ack=4862 Win=63119 Len=0 TSval=0 TSecr=3672693410"
"28","3.732563","192.168.137.186","184.28.60.243","TCP","66","59336  >  443 [ACK] Seq=696 Ack=4916 Win=63066 Len=0 TSval=0 TSecr=3672693410"
"29","3.734120","192.168.137.186","184.28.60.243","TLSv1.1","119","Encrypted Alert"
"30","3.734870","192.168.137.186","184.28.60.243","TCP","66","59336  >  443 [FIN, ACK] Seq=749 Ack=4916 Win=65535 Len=0 TSval=0 TSecr=3672693410"
"31","3.761308","184.28.60.243","192.168.137.186","TCP","54","443  >  59336 [RST] Seq=4916 Win=0 Len=0"
"32","3.765836","184.28.60.243","192.168.137.186","TCP","54","443  >  59336 [RST] Seq=4916 Win=0 Len=0"
"33","3.765871","184.28.60.243","192.168.137.186","TCP","54","443  >  59336 [RST] Seq=4916 Win=0 Len=0"
"34","4.045016","192.168.137.186","239.255.255.250","SSDP","179","M-SEARCH * HTTP/1.1 "
"35","5.029342","Dell_c7:e0:05","Broadcast","ARP","42","Who has 10.0.0.1? Tell 192.168.137.1"
"36","5.045554","192.168.137.186","52.40.62.52","CLASSIC-STUN","98","Message: Binding Request"
"37","5.147557","52.40.62.52","192.168.137.186","CLASSIC-STUN","122","Message: Binding Response"
"38","5.151730","192.168.137.186","52.40.62.52","CLASSIC-STUN","98","Message: Binding Request"
"39","5.151730","192.168.137.186","192.168.137.1","DNS","104","Standard query 0x3e11 A static-resource.np.community.playstation.net"
"40","5.176626","192.168.137.1","192.168.137.186","DNS","220","Standard query response 0x3e11 A static-resource.np.community.playstation.net CNAME static-resource.np.community.playstation.net.edgekey.net CNAME e6234.g.akamaiedge.net A 104.77.8.241"
"41","5.179285","192.168.137.186","104.77.8.241","TCP","78","59335  >  80 [SYN] Seq=0 Win=65535 Len=0 MSS=1460 WS=1 SACK_PERM=1 TSval=0 TSecr=0"
"42","5.207900","104.77.8.241","192.168.137.186","TCP","74","80  >  59335 [SYN, ACK] Seq=0 Ack=1 Win=28960 Len=0 MSS=1460 SACK_PERM=1 TSval=1069230983 TSecr=0 WS=128"
"43","5.210347","192.168.137.186","104.77.8.241","TCP","66","59335  >  80 [ACK] Seq=1 Ack=1 Win=65535 Len=0 TSval=0 TSecr=1069230983"
"44","5.210347","192.168.137.186","104.77.8.241","HTTP","262","GET /np/resource/communication-polling/communication-polling-status.xml HTTP/1.1 "
"45","5.245769","104.77.8.241","192.168.137.186","TCP","66","80  >  59335 [ACK] Seq=1 Ack=197 Win=30080 Len=0 TSval=1069231020 TSecr=0"
"46","5.245796","104.77.8.241","192.168.137.186","TCP","66","[TCP Dup ACK 45#1] 80  >  59335 [ACK] Seq=1 Ack=197 Win=30080 Len=0 TSval=1069231020 TSecr=0"
"47","5.245810","104.77.8.241","192.168.137.186","HTTP/XML","604","HTTP/1.1 200 OK "
"48","5.248674","192.168.137.186","104.77.8.241","TCP","66","59335  >  80 [FIN, ACK] Seq=197 Ack=539 Win=65535 Len=0 TSval=0 TSecr=1069231021"
"49","5.248674","192.168.137.186","192.168.137.1","DNS","117","Standard query 0x111b A communication-polling.gb.np.communication.playstation.net"
"50","5.253112","52.40.62.52","192.168.137.186","CLASSIC-STUN","122","Message: Binding Response"
"51","5.255575","192.168.137.186","52.40.62.53","CLASSIC-STUN","98","Message: Binding Request"
"52","5.279550","104.77.8.241","192.168.137.186","TCP","66","80  >  59335 [FIN, ACK] Seq=539 Ack=198 Win=30080 Len=0 TSval=1069231056 TSecr=0"
"53","5.279712","192.168.137.1","192.168.137.186","DNS","169","Standard query response 0x111b A communication-polling.gb.np.communication.playstation.net CNAME polling.usw2.np.cn.s0.playstation.net A 34.223.209.103"
"54","5.281954","192.168.137.186","104.77.8.241","TCP","66","59335  >  80 [ACK] Seq=198 Ack=540 Win=65535 Len=0 TSval=0 TSecr=1069231056"
"55","5.285525","192.168.137.186","192.168.137.1","DNS","98","Standard query 0x7427 A b6.gb.np.communication.playstation.net"
"56","5.311367","192.168.137.1","192.168.137.186","DNS","173","Standard query response 0x7427 A b6.gb.np.communication.playstation.net CNAME elb001-im84.im.usw2.np.cn.s0.playstation.net A 52.40.211.249 A 34.214.91.195"
"57","5.313835","192.168.137.186","52.40.211.249","TCP","78","59334  >  5223 [SYN] Seq=0 Win=65535 Len=0 MSS=1460 WS=1 SACK_PERM=1 TSval=1 TSecr=0"
"58","5.359297","52.40.62.53","192.168.137.186","CLASSIC-STUN","122","Message: Binding Response"
"59","5.416722","52.40.211.249","192.168.137.186","TCP","74","5223  >  59334 [SYN, ACK] Seq=0 Ack=1 Win=26847 Len=0 MSS=1460 SACK_PERM=1 TSval=277264239 TSecr=1 WS=256"
"60","5.421442","192.168.137.186","52.40.211.249","TCP","66","59334  >  5223 [ACK] Seq=1 Ack=1 Win=65535 Len=0 TSval=1 TSecr=277264239"
"61","5.421442","192.168.137.186","52.40.211.249","TLSv1.1","126","Client Hello"
"62","5.527208","52.40.211.249","192.168.137.186","TCP","66","5223  >  59334 [ACK] Seq=1 Ack=61 Win=26880 Len=0 TSval=277264349 TSecr=1"
"63","5.527236","52.40.211.249","192.168.137.186","TLSv1.1","1286","Server Hello, Certificate, Server Hello Done"
"64","5.608052","192.168.137.186","52.40.211.249","TLSv1.1","408","Client Key Exchange, Change Cipher Spec, Encrypted Handshake Message"
"65","5.710247","52.40.211.249","192.168.137.186","TLSv1.1","141","Change Cipher Spec, Encrypted Handshake Message"
"66","5.713339","192.168.137.186","52.40.211.249","TLSv1.1","343","Application Data"
"67","5.814756","52.40.211.249","192.168.137.186","TLSv1.1","279","Application Data"
"68","5.814871","52.40.211.249","192.168.137.186","TLSv1.1","375","Application Data"
"69","5.817346","192.168.137.186","52.40.211.249","TCP","66","59334  >  5223 [ACK] Seq=680 Ack=1818 Win=65178 Len=0 TSval=2 TSecr=277264637"
"70","5.819095","192.168.137.186","52.40.211.249","TLSv1.1","999","Application Data"
"71","5.967087","52.40.211.249","192.168.137.186","TCP","66","5223  >  59334 [ACK] Seq=1818 Ack=1613 Win=30976 Len=0 TSval=277264788 TSecr=2"
"72","5.969650","52.40.211.249","192.168.137.186","TLSv1.1","215","Application Data"
"73","5.972453","192.168.137.186","52.40.211.249","TLSv1.1","119","Application Data"
"74","5.975103","192.168.137.186","104.77.8.241","TCP","78","59333  >  80 [SYN] Seq=0 Win=65535 Len=0 MSS=1460 WS=1 SACK_PERM=1 TSval=0 TSecr=0"
"75","5.978702","Dell_c7:e0:05","Broadcast","ARP","42","Who has 10.0.0.1? Tell 192.168.137.1"
"76","5.987015","192.168.137.186","192.168.137.1","DNS","100","Standard query 0x87a7 A us-push.np.communication.playstation.net"
"77","6.003247","104.77.8.241","192.168.137.186","TCP","74","80  >  59333 [SYN, ACK] Seq=0 Ack=1 Win=28960 Len=0 MSS=1460 SACK_PERM=1 TSval=1069231779 TSecr=0 WS=128"
"78","6.005718","192.168.137.186","104.77.8.241","TCP","66","59333  >  80 [ACK] Seq=1 Ack=1 Win=65535 Len=0 TSval=0 TSecr=1069231779"
"79","6.005718","192.168.137.186","104.77.8.241","HTTP","266","GET /np/resource/friendlist/friendlist-status.xml HTTP/1.1 "
"80","6.009330","192.168.137.1","192.168.137.186","DNS","280","Standard query response 0x87a7 A us-push.np.communication.playstation.net CNAME alb001-push-cc2s01.push.usw2.np.cn.s0.playstation.net A 54.69.67.84 A 52.32.117.81 A 35.164.121.159 A 54.191.136.72 A 35.165.11.118 A 34.213.145.198 A 54.188.95.191 A 35.165.107.189"
"81","6.012933","192.168.137.186","54.69.67.84","TCP","78","59332  >  443 [SYN] Seq=0 Win=65535 Len=0 MSS=1460 WS=1 SACK_PERM=1 TSval=0 TSecr=0"
"82","6.040641","104.77.8.241","192.168.137.186","TCP","66","80  >  59333 [ACK] Seq=1 Ack=201 Win=30080 Len=0 TSval=1069231817 TSecr=0"
"83","6.040665","104.77.8.241","192.168.137.186","TCP","66","[TCP Dup ACK 82#1] 80  >  59333 [ACK] Seq=1 Ack=201 Win=30080 Len=0 TSval=1069231817 TSecr=0"
"84","6.072964","52.40.211.249","192.168.137.186","TCP","66","5223  >  59334 [ACK] Seq=1967 Ack=1666 Win=30976 Len=0 TSval=277264896 TSecr=2"
"85","6.075469","192.168.137.186","52.40.211.249","TLSv1.1","609","Application Data, Application Data, Application Data"
"86","6.115719","54.69.67.84","192.168.137.186","TCP","74","443  >  59332 [SYN, ACK] Seq=0 Ack=1 Win=26847 Len=0 MSS=1460 SACK_PERM=1 TSval=1132465585 TSecr=0 WS=256"
"87","6.118527","192.168.137.186","54.69.67.84","TCP","66","59332  >  443 [ACK] Seq=1 Ack=1 Win=65535 Len=0 TSval=0 TSecr=1132465585"
"88","6.119354","192.168.137.186","54.69.67.84","TLSv1.1","126","Client Hello"
"89","6.178925","52.40.211.249","192.168.137.186","TCP","66","5223  >  59334 [ACK] Seq=1967 Ack=2209 Win=32768 Len=0 TSval=277265001 TSecr=2"
"90","6.181167","52.40.211.249","192.168.137.186","TLSv1.1","327","Application Data"
"91","6.185746","52.40.211.249","192.168.137.186","TLSv1.1","215","Application Data"
"92","6.185773","52.40.211.249","192.168.137.186","TLSv1.1","375","Application Data"
"93","6.193692","192.168.137.186","52.40.211.249","TCP","66","59334  >  5223 [ACK] Seq=2209 Ack=2377 Win=65535 Len=0 TSval=2 TSecr=277265004"
"94","6.225185","54.69.67.84","192.168.137.186","TCP","66","443  >  59332 [ACK] Seq=1 Ack=61 Win=26880 Len=0 TSval=1132465613 TSecr=0"
"95","6.225210","54.69.67.84","192.168.137.186","TCP","66","[TCP Dup ACK 94#1] 443  >  59332 [ACK] Seq=1 Ack=61 Win=26880 Len=0 TSval=1132465613 TSecr=0"
"96","6.225239","54.69.67.84","192.168.137.186","TLSv1.1","1514","Server Hello"
"97","6.225252","54.69.67.84","192.168.137.186","TLSv1.1","821","Certificate, Server Hello Done"
"98","6.227830","192.168.137.186","54.69.67.84","TCP","66","59332  >  443 [ACK] Seq=61 Ack=2204 Win=63497 Len=0 TSval=0 TSecr=1132465613"
"99","6.298092","104.77.8.241","192.168.137.186","HTTP/XML","522","HTTP/1.1 200 OK "
"100","6.314940","192.168.137.186","54.69.67.84","TLSv1.1","408","Client Key Exchange, Change Cipher Spec, Encrypted Handshake Message"
"101","6.314940","192.168.137.186","104.77.8.241","TCP","66","59333  >  80 [FIN, ACK] Seq=201 Ack=457 Win=65535 Len=0 TSval=1 TSecr=1069232073"
"102","6.318751","192.168.137.186","192.168.137.1","DNS","112","Standard query 0x309d A friend-list-view.us.np.communication.playstation.net"
"103","6.344210","104.77.8.241","192.168.137.186","TCP","66","80  >  59333 [FIN, ACK] Seq=457 Ack=202 Win=30080 Len=0 TSval=1069232120 TSecr=1"
"104","6.344248","192.168.137.1","192.168.137.186","DNS","236","Standard query response 0x309d A friend-list-view.us.np.communication.playstation.net CNAME friend-list-view.us.np.communication.playstation.net.edgekey.net CNAME e9767.b.akamaiedge.net A 104.82.23.30"
"105","6.348450","192.168.137.186","104.77.8.241","TCP","66","59333  >  80 [ACK] Seq=202 Ack=458 Win=65535 Len=0 TSval=1 TSecr=1069232120"
"106","6.348450","192.168.137.186","104.82.23.30","TCP","78","59331  >  443 [SYN] Seq=0 Win=65535 Len=0 MSS=1460 WS=1 SACK_PERM=1 TSval=0 TSecr=0"
"107","6.372089","104.82.23.30","192.168.137.186","TCP","74","443  >  59331 [SYN, ACK] Seq=0 Ack=1 Win=28960 Len=0 MSS=1460 SACK_PERM=1 TSval=421654147 TSecr=0 WS=128"
"108","6.374435","192.168.137.186","104.82.23.30","TCP","66","59331  >  443 [ACK] Seq=1 Ack=1 Win=65535 Len=0 TSval=0 TSecr=421654147"
"109","6.375883","192.168.137.186","104.82.23.30","TLSv1.1","126","Client Hello"
"110","6.384257","192.168.137.186","52.40.211.249","TCP","66","59334  >  5223 [ACK] Seq=2209 Ack=2686 Win=65535 Len=0 TSval=3 TSecr=277265009"
"111","6.402227","104.82.23.30","192.168.137.186","TCP","66","443  >  59331 [ACK] Seq=1 Ack=61 Win=29056 Len=0 TSval=421654178 TSecr=0"
"112","6.423260","54.69.67.84","192.168.137.186","TLSv1.1","141","Change Cipher Spec, Encrypted Handshake Message"
"113","6.436496","192.168.137.186","54.69.67.84","TLSv1.1","327","Application Data"
"114","6.450569","104.82.23.30","192.168.137.186","TLSv1.1","1514","Server Hello"
"115","6.450595","104.82.23.30","192.168.137.186","TCP","1514","443  >  59331 [ACK] Seq=1449 Ack=61 Win=29056 Len=1448 TSval=421654226 TSecr=0 [TCP segment of a reassembled PDU]"
"116","6.450611","104.82.23.30","192.168.137.186","TCP","1266","443  >  59331 [PSH, ACK] Seq=2897 Ack=61 Win=29056 Len=1200 TSval=421654226 TSecr=0 [TCP segment of a reassembled PDU]"
"117","6.450641","104.82.23.30","192.168.137.186","TCP","1514","443  >  59331 [ACK] Seq=4097 Ack=61 Win=29056 Len=1448 TSval=421654226 TSecr=0 [TCP segment of a reassembled PDU]"
"118","6.453413","192.168.137.186","104.82.23.30","TCP","66","59331  >  443 [ACK] Seq=61 Ack=2897 Win=62804 Len=0 TSval=0 TSecr=421654226"
"119","6.453796","192.168.137.186","104.82.23.30","TCP","66","59331  >  443 [ACK] Seq=61 Ack=5545 Win=60156 Len=0 TSval=0 TSecr=421654226"
"120","6.455143","192.168.137.186","104.82.23.30","TCP","66","[TCP Window Update] 59331  >  443 [ACK] Seq=61 Ack=5545 Win=65535 Len=0 TSval=0 TSecr=421654226"
"121","6.492885","104.82.23.30","192.168.137.186","TLSv1.1","887","Certificate, Server Hello Done"
"122","6.575082","54.69.67.84","192.168.137.186","TLSv1.1","375","Application Data"
"123","6.585282","192.168.137.186","104.82.23.30","TLSv1.1","408","Client Key Exchange, Change Cipher Spec, Encrypted Handshake Message"
"124","6.585282","192.168.137.186","54.69.67.84","TLSv1.1","119","Encrypted Alert"
"125","6.585282","192.168.137.186","54.69.67.84","TCP","66","59332  >  443 [FIN, ACK] Seq=717 Ack=2588 Win=65535 Len=0 TSval=1 TSecr=1132465700"
"126","6.587574","192.168.137.186","192.168.137.1","DNS","112","Standard query 0x2527 A 52-11-11-135-pushcl.np.communication.playstation.net"
"127","6.614341","104.82.23.30","192.168.137.186","TCP","66","443  >  59331 [ACK] Seq=6366 Ack=403 Win=30080 Len=0 TSval=421654385 TSecr=0"
"128","6.619969","104.82.23.30","192.168.137.186","TLSv1.1","141","Change Cipher Spec, Encrypted Handshake Message"
"129","6.621239","192.168.137.1","192.168.137.186","DNS","128","Standard query response 0x2527 A 52-11-11-135-pushcl.np.communication.playstation.net A 52.11.11.135"
"130","6.621312","192.168.137.1","192.168.137.186","DNS","128","Standard query response 0x2527 A 52-11-11-135-pushcl.np.communication.playstation.net A 52.11.11.135"
"131","6.627711","192.168.137.186","104.82.23.30","TLSv1.1","311","Application Data"
"132","6.627711","192.168.137.186","104.82.23.30","TLSv1.1","967","Application Data"
"133","6.627711","192.168.137.186","52.11.11.135","TCP","78","59330  >  443 [SYN] Seq=0 Win=65535 Len=0 MSS=1460 WS=1 SACK_PERM=1 TSval=0 TSecr=0"
"134","6.664672","104.82.23.30","192.168.137.186","TCP","66","443  >  59331 [ACK] Seq=6441 Ack=1549 Win=33024 Len=0 TSval=421654432 TSecr=0"
"135","6.689148","54.69.67.84","192.168.137.186","TCP","78","[TCP Dup ACK 122#1] 443  >  59332 [ACK] Seq=2588 Ack=664 Win=29184 Len=0 TSval=1132465729 TSecr=1 SLE=717 SRE=718"
"136","6.689173","54.69.67.84","192.168.137.186","TCP","66","443  >  59332 [ACK] Seq=2588 Ack=718 Win=29184 Len=0 TSval=1132465729 TSecr=1"
"137","6.689186","54.69.67.84","192.168.137.186","TCP","66","443  >  59332 [FIN, ACK] Seq=2588 Ack=718 Win=29184 Len=0 TSval=1132465729 TSecr=1"
"138","6.691368","192.168.137.186","54.69.67.84","TLSv1.1","119","[TCP Spurious Retransmission] , Encrypted Alert"
"139","6.691368","192.168.137.186","54.69.67.84","TCP","66","59332  >  443 [ACK] Seq=718 Ack=2589 Win=65535 Len=0 TSval=1 TSecr=1132465729"
"140","6.729666","52.11.11.135","192.168.137.186","TCP","74","443  >  59330 [SYN, ACK] Seq=0 Ack=1 Win=17898 Len=0 MSS=1460 SACK_PERM=1 TSval=3622627437 TSecr=0 WS=512"
"141","6.734437","192.168.137.186","52.11.11.135","TCP","66","59330  >  443 [ACK] Seq=1 Ack=1 Win=65535 Len=0 TSval=0 TSecr=3622627437"
"142","6.736066","192.168.137.186","52.11.11.135","TLSv1.1","126","Client Hello"
"143","6.792196","54.69.67.84","192.168.137.186","TCP","78","[TCP Dup ACK 136#1] 443  >  59332 [ACK] Seq=2589 Ack=718 Win=29184 Len=0 TSval=1132465755 TSecr=1 SLE=664 SRE=718"
"144","6.842687","52.11.11.135","192.168.137.186","TCP","66","443  >  59330 [ACK] Seq=1 Ack=61 Win=17920 Len=0 TSval=3622627551 TSecr=0"
"145","6.842712","52.11.11.135","192.168.137.186","TLSv1.1","1284","Server Hello, Certificate, Server Hello Done"
"146","6.926493","192.168.137.186","52.11.11.135","TLSv1.1","408","Client Key Exchange, Change Cipher Spec, Encrypted Handshake Message"
"147","6.981390","Dell_c7:e0:05","Broadcast","ARP","42","Who has 10.0.0.1? Tell 192.168.137.1"
"148","7.029076","52.11.11.135","192.168.137.186","TLSv1.1","141","Change Cipher Spec, Encrypted Handshake Message"
"149","7.035961","192.168.137.186","52.11.11.135","TLSv1.1","1047","Application Data"
"150","7.041065","192.168.137.186","192.168.137.1","DNS","92","Standard query 0xef91 A asm.np.community.playstation.net"
"151","7.067868","192.168.137.1","192.168.137.186","DNS","297","Standard query response 0xef91 A asm.np.community.playstation.net CNAME 13673-wildcard.np.community.playstation.net.edgekey.net CNAME 13673-wildcard.np.community.playstation.net.edgekey.net.globalredir.akadns.net CNAME e13673.b.akamaiedge.net A 23.36.32.208"
"152","7.067945","192.168.137.1","192.168.137.186","DNS","297","Standard query response 0xef91 A asm.np.community.playstation.net CNAME 13673-wildcard.np.community.playstation.net.edgekey.net CNAME 13673-wildcard.np.community.playstation.net.edgekey.net.globalredir.akadns.net CNAME e13673.b.akamaiedge.net A 23.36.32.208"
"153","7.070591","192.168.137.186","23.36.32.208","TCP","78","59329  >  443 [SYN] Seq=0 Win=65535 Len=0 MSS=1460 WS=1 SACK_PERM=1 TSval=0 TSecr=0"
"154","7.093022","23.36.32.208","192.168.137.186","TCP","74","443  >  59329 [SYN, ACK] Seq=0 Ack=1 Win=28960 Len=0 MSS=1460 SACK_PERM=1 TSval=1168263386 TSecr=0 WS=128"
"155","7.096138","192.168.137.186","23.36.32.208","TCP","66","59329  >  443 [ACK] Seq=1 Ack=1 Win=65535 Len=0 TSval=0 TSecr=1168263386"
"156","7.101945","104.82.23.30","192.168.137.186","TLSv1.1","455","Application Data"
"157","7.101975","104.82.23.30","192.168.137.186","TLSv1.1","119","Encrypted Alert"
"158","7.102002","104.82.23.30","192.168.137.186","TCP","66","443  >  59331 [FIN, ACK] Seq=6883 Ack=1549 Win=33024 Len=0 TSval=421654877 TSecr=0"
"159","7.102295","192.168.137.186","23.36.32.208","TLSv1.1","126","Client Hello"
"160","7.104705","192.168.137.186","104.82.23.30","TCP","66","59331  >  443 [ACK] Seq=1549 Ack=6883 Win=65258 Len=0 TSval=1 TSecr=421654877"
"161","7.104705","192.168.137.186","104.82.23.30","TCP","66","59331  >  443 [ACK] Seq=1549 Ack=6884 Win=65258 Len=0 TSval=1 TSecr=421654877"
"162","7.104705","192.168.137.186","104.82.23.30","TLSv1.1","119","Encrypted Alert"
"163","7.105527","192.168.137.186","104.82.23.30","TCP","66","59331  >  443 [FIN, ACK] Seq=1602 Ack=6884 Win=65535 Len=0 TSval=1 TSecr=421654877"
"164","7.107818","192.168.137.186","104.82.23.30","TCP","78","59328  >  443 [SYN] Seq=0 Win=65535 Len=0 MSS=1460 WS=1 SACK_PERM=1 TSval=0 TSecr=0"
"165","7.130191","104.82.23.30","192.168.137.186","TCP","54","443  >  59331 [RST] Seq=6884 Win=0 Len=0"
"166","7.130275","23.36.32.208","192.168.137.186","TCP","66","443  >  59329 [ACK] Seq=1 Ack=61 Win=29056 Len=0 TSval=1168263423 TSecr=0"
"167","7.130339","23.36.32.208","192.168.137.186","TLSv1.1","1514","Server Hello"
"168","7.130358","23.36.32.208","192.168.137.186","TCP","1514","443  >  59329 [ACK] Seq=1449 Ack=61 Win=29056 Len=1448 TSval=1168263423 TSecr=0 [TCP segment of a reassembled PDU]"
"169","7.130377","104.82.23.30","192.168.137.186","TCP","54","443  >  59331 [RST] Seq=6884 Win=0 Len=0"
"170","7.130397","23.36.32.208","192.168.137.186","TLSv1.1","245","Certificate, Server Hello Done"
"171","7.132567","192.168.137.186","23.36.32.208","TCP","66","59329  >  443 [ACK] Seq=61 Ack=2897 Win=62804 Len=0 TSval=0 TSecr=1168263423"
"172","7.132991","104.82.23.30","192.168.137.186","TCP","74","443  >  59328 [SYN, ACK] Seq=0 Ack=1 Win=28960 Len=0 MSS=1460 SACK_PERM=1 TSval=421654909 TSecr=0 WS=128"
"173","7.135523","192.168.137.186","104.82.23.30","TCP","66","59328  >  443 [ACK] Seq=1 Ack=1 Win=65535 Len=0 TSval=0 TSecr=421654909"
"174","7.137029","192.168.137.186","104.82.23.30","TLSv1.1","126","Client Hello"
"175","7.137652","192.168.137.186","23.36.32.208","TCP","66","59329  >  443 [ACK] Seq=61 Ack=3076 Win=65535 Len=0 TSval=0 TSecr=1168263423"
"176","7.158639","52.11.11.135","192.168.137.186","TLSv1.1","391","Application Data"
"177","7.163346","104.82.23.30","192.168.137.186","TCP","66","443  >  59328 [ACK] Seq=1 Ack=61 Win=29056 Len=0 TSval=421654938 TSecr=0"
"178","7.163381","104.82.23.30","192.168.137.186","TCP","66","[TCP Dup ACK 177#1] 443  >  59328 [ACK] Seq=1 Ack=61 Win=29056 Len=0 TSval=421654938 TSecr=0"
"179","7.164643","104.82.23.30","192.168.137.186","TLSv1.1","1514","Server Hello"
"180","7.164674","104.82.23.30","192.168.137.186","TCP","1514","443  >  59328 [ACK] Seq=1449 Ack=61 Win=29056 Len=1448 TSval=421654938 TSecr=0 [TCP segment of a reassembled PDU]"
"181","7.164690","104.82.23.30","192.168.137.186","TCP","1266","443  >  59328 [PSH, ACK] Seq=2897 Ack=61 Win=29056 Len=1200 TSval=421654938 TSecr=0 [TCP segment of a reassembled PDU]"
"182","7.164706","104.82.23.30","192.168.137.186","TCP","1514","443  >  59328 [ACK] Seq=4097 Ack=61 Win=29056 Len=1448 TSval=421654938 TSecr=0 [TCP segment of a reassembled PDU]"
"183","7.167486","192.168.137.186","104.82.23.30","TCP","66","59328  >  443 [ACK] Seq=61 Ack=2897 Win=62804 Len=0 TSval=0 TSecr=421654938"
"184","7.167486","192.168.137.186","104.82.23.30","TCP","66","59328  >  443 [ACK] Seq=61 Ack=5545 Win=60156 Len=0 TSval=0 TSecr=421654938"
"185","7.169246","192.168.137.186","104.82.23.30","TCP","66","[TCP Window Update] 59328  >  443 [ACK] Seq=61 Ack=5545 Win=65535 Len=0 TSval=0 TSecr=421654938"
"186","7.172863","192.168.137.186","52.11.11.135","TLSv1.1","295","Application Data"
"187","7.189802","104.82.23.30","192.168.137.186","TLSv1.1","887","Certificate, Server Hello Done"
"188","7.282727","192.168.137.186","104.82.23.30","TLSv1.1","408","Client Key Exchange, Change Cipher Spec, Encrypted Handshake Message"
"189","7.294101","52.11.11.135","192.168.137.186","TLSv1.1","231","Application Data"
"190","7.311780","104.82.23.30","192.168.137.186","TLSv1.1","141","Change Cipher Spec, Encrypted Handshake Message"
"191","7.315395","192.168.137.186","104.82.23.30","TLSv1.1","311","Application Data"
"192","7.316321","192.168.137.186","104.82.23.30","TLSv1.1","967","Application Data"
"193","7.344263","104.82.23.30","192.168.137.186","TCP","66","443  >  59328 [ACK] Seq=6441 Ack=1549 Win=33024 Len=0 TSval=421655119 TSecr=1"
"194","7.348045","192.168.137.186","23.36.32.208","TLSv1.1","408","Client Key Exchange, Change Cipher Spec, Encrypted Handshake Message"
"195","7.375092","23.36.32.208","192.168.137.186","TLSv1.1","141","Change Cipher Spec, Encrypted Handshake Message"
"196","7.381898","192.168.137.186","23.36.32.208","TLSv1.1","391","Application Data"
"197","7.381898","192.168.137.186","23.36.32.208","TLSv1.1","215","Application Data"
"198","7.410637","23.36.32.208","192.168.137.186","TCP","66","443  >  59329 [ACK] Seq=3151 Ack=877 Win=32256 Len=0 TSval=1168263704 TSecr=1"
"199","7.474810","104.82.23.30","192.168.137.186","TLSv1.1","375","Application Data"
"200","7.474834","104.82.23.30","192.168.137.186","TLSv1.1","119","Encrypted Alert"
"201","7.474861","104.82.23.30","192.168.137.186","TCP","66","443  >  59328 [FIN, ACK] Seq=6803 Ack=1549 Win=33024 Len=0 TSval=421655251 TSecr=1"
"202","7.479212","192.168.137.186","104.82.23.30","TCP","66","59328  >  443 [ACK] Seq=1549 Ack=6803 Win=65338 Len=0 TSval=1 TSecr=421655250"
"203","7.479212","192.168.137.186","104.82.23.30","TCP","66","59328  >  443 [ACK] Seq=1549 Ack=6804 Win=65338 Len=0 TSval=1 TSecr=421655251"
"204","7.479212","192.168.137.186","104.82.23.30","TLSv1.1","119","Encrypted Alert"
"205","7.479212","192.168.137.186","104.82.23.30","TCP","66","59328  >  443 [FIN, ACK] Seq=1602 Ack=6804 Win=65535 Len=0 TSval=1 TSecr=421655251"
"206","7.481672","192.168.137.186","104.82.23.30","TCP","78","59327  >  443 [SYN] Seq=0 Win=65535 Len=0 MSS=1460 WS=1 SACK_PERM=1 TSval=0 TSecr=0"
"207","7.498292","192.168.137.186","52.11.11.135","TCP","66","59330  >  443 [ACK] Seq=1613 Ack=1784 Win=65535 Len=0 TSval=2 TSecr=3622628002"
"208","7.505651","104.82.23.30","192.168.137.186","TCP","74","443  >  59327 [SYN, ACK] Seq=0 Ack=1 Win=28960 Len=0 MSS=1460 SACK_PERM=1 TSval=421655280 TSecr=0 WS=128"
"209","7.507860","192.168.137.186","104.82.23.30","TCP","66","59327  >  443 [ACK] Seq=1 Ack=1 Win=65535 Len=0 TSval=0 TSecr=421655280"
"210","7.508034","104.82.23.30","192.168.137.186","TCP","54","443  >  59328 [RST] Seq=6804 Win=0 Len=0"
"211","7.510203","192.168.137.186","104.82.23.30","TLSv1.1","126","Client Hello"
"212","7.516041","23.36.32.208","192.168.137.186","TLSv1.1","1079","Application Data"
"213","7.520883","192.168.137.186","23.36.32.208","TLSv1.1","119","Encrypted Alert"
"214","7.521675","192.168.137.186","23.36.32.208","TCP","66","59329  >  443 [FIN, ACK] Seq=930 Ack=4164 Win=65535 Len=0 TSval=1 TSecr=1168263808"
"215","7.527918","192.168.137.186","192.168.137.1","DNS","96","Standard query 0xe643 A us-gmsg.np.community.playstation.net"
"216","7.537309","104.82.23.30","192.168.137.186","TCP","66","443  >  59327 [ACK] Seq=1 Ack=61 Win=29056 Len=0 TSval=421655313 TSecr=0"
"217","7.537333","104.82.23.30","192.168.137.186","TLSv1.1","1514","Server Hello"
"218","7.537363","104.82.23.30","192.168.137.186","TCP","1514","443  >  59327 [ACK] Seq=1449 Ack=61 Win=29056 Len=1448 TSval=421655313 TSecr=0 [TCP segment of a reassembled PDU]"
"219","7.537377","104.82.23.30","192.168.137.186","TCP","1266","443  >  59327 [PSH, ACK] Seq=2897 Ack=61 Win=29056 Len=1200 TSval=421655313 TSecr=0 [TCP segment of a reassembled PDU]"
"220","7.537389","104.82.23.30","192.168.137.186","TCP","1514","443  >  59327 [ACK] Seq=4097 Ack=61 Win=29056 Len=1448 TSval=421655313 TSecr=0 [TCP segment of a reassembled PDU]"
"221","7.539634","192.168.137.186","104.82.23.30","TCP","66","59327  >  443 [ACK] Seq=61 Ack=2897 Win=62804 Len=0 TSval=0 TSecr=421655313"
"222","7.539634","192.168.137.186","104.82.23.30","TCP","66","59327  >  443 [ACK] Seq=61 Ack=5545 Win=60156 Len=0 TSval=0 TSecr=421655313"
"223","7.540226","192.168.137.186","104.82.23.30","TCP","66","[TCP Window Update] 59327  >  443 [ACK] Seq=61 Ack=5545 Win=65535 Len=0 TSval=0 TSecr=421655313"
"224","7.544421","23.36.32.208","192.168.137.186","TLSv1.1","119","Encrypted Alert"
"225","7.544463","23.36.32.208","192.168.137.186","TCP","66","443  >  59329 [FIN, ACK] Seq=4217 Ack=930 Win=32256 Len=0 TSval=1168263838 TSecr=1"
"226","7.546849","192.168.137.186","23.36.32.208","TCP","60","59329  >  443 [RST] Seq=930 Win=0 Len=0"
"227","7.546849","192.168.137.186","23.36.32.208","TCP","60","59329  >  443 [RST] Seq=930 Win=0 Len=0"
"228","7.548447","23.36.32.208","192.168.137.186","TCP","66","443  >  59329 [ACK] Seq=4218 Ack=931 Win=32256 Len=0 TSval=1168263842 TSecr=1"
"229","7.548557","192.168.137.1","192.168.137.186","DNS","301","Standard query response 0xe643 A us-gmsg.np.community.playstation.net CNAME 13673-wildcard.np.community.playstation.net.edgekey.net CNAME 13673-wildcard.np.community.playstation.net.edgekey.net.globalredir.akadns.net CNAME e13673.b.akamaiedge.net A 23.36.32.208"
"230","7.550856","192.168.137.186","23.36.32.208","TCP","60","59329  >  443 [RST] Seq=931 Win=0 Len=0"
"231","7.550856","192.168.137.186","23.36.32.208","TCP","78","59326  >  443 [SYN] Seq=0 Win=65535 Len=0 MSS=1460 WS=1 SACK_PERM=1 TSval=0 TSecr=0"
"232","7.563709","104.82.23.30","192.168.137.186","TLSv1.1","887","Certificate, Server Hello Done"
"233","7.572833","23.36.32.208","192.168.137.186","TCP","74","443  >  59326 [SYN, ACK] Seq=0 Ack=1 Win=28960 Len=0 MSS=1460 SACK_PERM=1 TSval=404591308 TSecr=0 WS=128"
"234","7.575008","192.168.137.186","23.36.32.208","TCP","66","59326  >  443 [ACK] Seq=1 Ack=1 Win=65535 Len=0 TSval=0 TSecr=404591308"
"235","7.623069","23.36.32.208","192.168.137.186","TCP","66","[TCP Retransmission] 443  >  59329 [FIN, ACK] Seq=4217 Ack=931 Win=32256 Len=0 TSval=1168263917 TSecr=1"
"236","7.625265","192.168.137.186","23.36.32.208","TCP","60","59329  >  443 [RST] Seq=931 Win=0 Len=0"
"237","7.651507","192.168.137.186","104.82.23.30","TLSv1.1","408","Client Key Exchange, Change Cipher Spec, Encrypted Handshake Message"
"238","7.654296","192.168.137.186","23.36.32.208","TLSv1.1","126","Client Hello"
"239","7.675453","104.82.23.30","192.168.137.186","TLSv1.1","141","Change Cipher Spec, Encrypted Handshake Message"
"240","7.677874","23.36.32.208","192.168.137.186","TCP","66","443  >  59326 [ACK] Seq=1 Ack=61 Win=29056 Len=0 TSval=404591414 TSecr=0"
"241","7.677900","23.36.32.208","192.168.137.186","TLSv1.1","1514","Server Hello"
"242","7.677928","23.36.32.208","192.168.137.186","TCP","1514","443  >  59326 [ACK] Seq=1449 Ack=61 Win=29056 Len=1448 TSval=404591414 TSecr=0 [TCP segment of a reassembled PDU]"
"243","7.677941","23.36.32.208","192.168.137.186","TLSv1.1","245","Certificate, Server Hello Done"
"244","7.678208","192.168.137.186","104.82.23.30","TLSv1.1","311","Application Data"
"245","7.679079","192.168.137.186","104.82.23.30","TLSv1.1","967","Application Data"
"246","7.680217","192.168.137.186","23.36.32.208","TCP","66","59326  >  443 [ACK] Seq=61 Ack=2897 Win=62804 Len=0 TSval=0 TSecr=404591414"
"247","7.681337","192.168.137.186","23.36.32.208","TCP","66","59326  >  443 [ACK] Seq=61 Ack=3076 Win=65535 Len=0 TSval=0 TSecr=404591414"
"248","7.707019","104.82.23.30","192.168.137.186","TCP","66","443  >  59327 [ACK] Seq=6441 Ack=1549 Win=33024 Len=0 TSval=421655482 TSecr=0"
"249","7.785958","192.168.137.186","23.36.32.208","TLSv1.1","408","Client Key Exchange, Change Cipher Spec, Encrypted Handshake Message"
"250","7.813753","23.36.32.208","192.168.137.186","TLSv1.1","141","Change Cipher Spec, Encrypted Handshake Message"
"251","7.817354","192.168.137.186","23.36.32.208","TLSv1.1","1175","Application Data"
"252","7.849349","104.82.23.30","192.168.137.186","TLSv1.1","375","Application Data"
"253","7.849374","104.82.23.30","192.168.137.186","TLSv1.1","119","Encrypted Alert"
"254","7.849385","104.82.23.30","192.168.137.186","TCP","66","443  >  59327 [FIN, ACK] Seq=6803 Ack=1549 Win=33024 Len=0 TSval=421655624 TSecr=0"
"255","7.851636","192.168.137.186","104.82.23.30","TCP","66","59327  >  443 [ACK] Seq=1549 Ack=6803 Win=65338 Len=0 TSval=1 TSecr=421655624"
"256","7.851636","192.168.137.186","104.82.23.30","TCP","66","59327  >  443 [ACK] Seq=1549 Ack=6804 Win=65338 Len=0 TSval=1 TSecr=421655624"
"257","7.853398","192.168.137.186","104.82.23.30","TLSv1.1","119","Encrypted Alert"
"258","7.854155","192.168.137.186","104.82.23.30","TCP","66","59327  >  443 [FIN, ACK] Seq=1602 Ack=6804 Win=65535 Len=0 TSval=1 TSecr=421655624"
"259","7.856614","192.168.137.186","52.40.211.249","TLSv1.1","327","Application Data"
"260","7.863775","23.36.32.208","192.168.137.186","TCP","119","[TCP Retransmission] 443  >  59329 [FIN, PSH, ACK] Seq=4164 Ack=931 Win=32256 Len=53 TSval=1168264158 TSecr=1"
"261","7.865979","192.168.137.186","23.36.32.208","TCP","60","59329  >  443 [RST] Seq=931 Win=0 Len=0"
"262","7.870135","192.168.137.186","192.168.137.1","DNS","99","Standard query 0x9cef A getprof.us.np.community.playstation.net"
"263","7.873425","192.168.137.186","23.36.32.208","TLSv1.1","119","Encrypted Alert"
"264","7.873425","192.168.137.186","23.36.32.208","TCP","66","59376  >  443 [FIN, ACK] Seq=54 Ack=1 Win=65535 Len=0 TSval=181 TSecr=1533007475"
"265","7.874278","192.168.137.186","192.168.137.1","DNS","95","Standard query 0x5e76 A us-ivt.np.community.playstation.net"
"266","7.886216","104.82.23.30","192.168.137.186","TCP","54","443  >  59327 [RST] Seq=6804 Win=0 Len=0"
"267","7.891690","192.168.137.1","192.168.137.186","DNS","218","Standard query response 0x9cef A getprof.us.np.community.playstation.net CNAME wildcard.wildcard.np.community.playstation.net.edgekey.net CNAME e16633.b.akamaiedge.net A 104.111.98.7"
"268","7.894005","192.168.137.186","104.111.98.7","TCP","78","59325  >  80 [SYN] Seq=0 Win=65535 Len=0 MSS=1460 WS=1 SACK_PERM=1 TSval=0 TSecr=0"
"269","7.895931","23.36.32.208","192.168.137.186","TCP","54","443  >  59376 [RST] Seq=1 Win=0 Len=0"
"270","7.899281","192.168.137.1","192.168.137.186","DNS","300","Standard query response 0x5e76 A us-ivt.np.community.playstation.net CNAME 13673-wildcard.np.community.playstation.net.edgekey.net CNAME 13673-wildcard.np.community.playstation.net.edgekey.net.globalredir.akadns.net CNAME e13673.b.akamaiedge.net A 23.36.32.208"
"271","7.902065","192.168.137.186","23.36.32.208","TCP","78","59324  >  443 [SYN] Seq=0 Win=65535 Len=0 MSS=1460 WS=1 SACK_PERM=1 TSval=0 TSecr=0"
"272","7.909725","23.36.32.208","192.168.137.186","TCP","66","443  >  59326 [ACK] Seq=3151 Ack=1512 Win=32256 Len=0 TSval=404591645 TSecr=1"
"273","7.918773","104.111.98.7","192.168.137.186","TCP","74","80  >  59325 [SYN, ACK] Seq=0 Ack=1 Win=28960 Len=0 MSS=1460 SACK_PERM=1 TSval=2206795260 TSecr=0 WS=128"
"274","7.921177","192.168.137.186","104.111.98.7","TCP","66","59325  >  80 [ACK] Seq=1 Ack=1 Win=65535 Len=0 TSval=0 TSecr=2206795260"
"275","7.921177","192.168.137.186","104.111.98.7","TCP","541","59325  >  80 [PSH, ACK] Seq=1 Ack=1 Win=65535 Len=475 TSval=0 TSecr=2206795260 [TCP segment of a reassembled PDU]"
"276","7.921177","192.168.137.186","104.111.98.7","HTTP","236","POST /basic_view/func/get_profile HTTP/1.1 "
"277","7.925476","23.36.32.208","192.168.137.186","TCP","74","443  >  59324 [SYN, ACK] Seq=0 Ack=1 Win=28960 Len=0 MSS=1460 SACK_PERM=1 TSval=1168264217 TSecr=0 WS=128"
"278","7.928573","192.168.137.186","23.36.32.208","TCP","66","59324  >  443 [ACK] Seq=1 Ack=1 Win=65535 Len=0 TSval=0 TSecr=1168264217"
"279","7.931688","192.168.137.186","23.36.32.208","TLSv1.1","126","Client Hello"
"280","7.953844","104.111.98.7","192.168.137.186","TCP","66","80  >  59325 [ACK] Seq=1 Ack=476 Win=30080 Len=0 TSval=2206795296 TSecr=0"
"281","7.953868","104.111.98.7","192.168.137.186","TCP","66","80  >  59325 [ACK] Seq=1 Ack=646 Win=31104 Len=0 TSval=2206795296 TSecr=0"
"282","7.955756","23.36.32.208","192.168.137.186","TLSv1.1","679","Application Data"
"283","7.957904","23.36.32.208","192.168.137.186","TCP","66","443  >  59324 [ACK] Seq=1 Ack=61 Win=29056 Len=0 TSval=1168264252 TSecr=0"
"284","7.957922","23.36.32.208","192.168.137.186","TLSv1.1","1514","Server Hello"
"285","7.957950","23.36.32.208","192.168.137.186","TCP","1514","443  >  59324 [ACK] Seq=1449 Ack=61 Win=29056 Len=1448 TSval=1168264253 TSecr=0 [TCP segment of a reassembled PDU]"
"286","7.957962","23.36.32.208","192.168.137.186","TLSv1.1","245","Certificate, Server Hello Done"
"287","7.960334","192.168.137.186","23.36.32.208","TCP","66","59324  >  443 [ACK] Seq=61 Ack=2897 Win=62804 Len=0 TSval=0 TSecr=1168264253"
"288","7.970890","192.168.137.186","23.36.32.208","TCP","66","59324  >  443 [ACK] Seq=61 Ack=3076 Win=65535 Len=0 TSval=0 TSecr=1168264253"
"289","7.979045","192.168.137.186","192.168.137.1","DNS","95","Standard query 0xe221 A us-ivt.np.community.playstation.net"
"290","8.001522","52.40.211.249","192.168.137.186","TCP","66","5223  >  59334 [ACK] Seq=2686 Ack=2470 Win=34816 Len=0 TSval=277266824 TSecr=6"
"291","8.001550","192.168.137.1","192.168.137.186","DNS","300","Standard query response 0xe221 A us-ivt.np.community.playstation.net CNAME 13673-wildcard.np.community.playstation.net.edgekey.net CNAME 13673-wildcard.np.community.playstation.net.edgekey.net.globalredir.akadns.net CNAME e13673.b.akamaiedge.net A 23.36.32.208"
"292","8.060113","104.111.98.7","192.168.137.186","HTTP","385","HTTP/1.1 401 Unauthorized  (text/html)"
"293","8.060137","104.111.98.7","192.168.137.186","TCP","66","80  >  59325 [FIN, ACK] Seq=320 Ack=646 Win=31104 Len=0 TSval=2206795403 TSecr=0"
"294","8.062420","192.168.137.186","104.111.98.7","TCP","66","59325  >  80 [ACK] Seq=646 Ack=321 Win=65381 Len=0 TSval=0 TSecr=2206795402"
"295","8.062957","192.168.137.186","104.111.98.7","TCP","66","59325  >  80 [FIN, ACK] Seq=646 Ack=321 Win=65535 Len=0 TSval=0 TSecr=2206795402"
"296","8.071120","192.168.137.186","192.168.137.1","DNS","99","Standard query 0xda2f A getprof.us.np.community.playstation.net"
"297","8.087271","192.168.137.186","23.36.32.208","TLSv1.1","408","Client Key Exchange, Change Cipher Spec, Encrypted Handshake Message"
"298","8.088545","192.168.137.186","23.36.32.208","TCP","78","59323  >  443 [SYN] Seq=0 Win=65535 Len=0 MSS=1460 WS=1 SACK_PERM=1 TSval=0 TSecr=0"
"299","8.095742","104.111.98.7","192.168.137.186","TCP","54","80  >  59325 [RST] Seq=321 Win=0 Len=0"
"300","8.101670","192.168.137.1","192.168.137.186","DNS","218","Standard query response 0xda2f A getprof.us.np.community.playstation.net CNAME wildcard.wildcard.np.community.playstation.net.edgekey.net CNAME e16633.b.akamaiedge.net A 104.111.98.7"
"301","8.104086","192.168.137.186","104.111.98.7","TCP","78","59322  >  80 [SYN] Seq=0 Win=65535 Len=0 MSS=1460 WS=1 SACK_PERM=1 TSval=0 TSecr=0"
"302","8.118427","23.36.32.208","192.168.137.186","TCP","74","443  >  59323 [SYN, ACK] Seq=0 Ack=1 Win=28960 Len=0 MSS=1460 SACK_PERM=1 TSval=1323562696 TSecr=0 WS=128"
